tweets,id,date,likes,retweets,clean_tweet,sentiment_negative,sentiment_positive,sentiment_neutral,subjectivityWining 2020 election is starting from today. Voting John Dramani Mahama is a vote for development,1232207634213855232,2020-02-25 07:36:07+00:00,0.0,0.0,wining election starting today voting john dramani mahama vote development,0.0,0.0,1.0,0.1
"And Former President J.A.Kuffour said unto the flag bearer of NDC (JOHN DRAMANI MAHAMA) worry not, you will surely win this year's election. #Am4JM #RescueMission",1232199898096902150,2020-02-25 07:05:23+00:00,10.0,0.0,former president j.a.kuffour said unto flag bearer ndc john dramani mahama worry surely win years election am4jm rescuemission,0.118,0.672,0.61,0.2
Rich but greedy John Dramani Mahama,1232078199934324740,2020-02-24 23:01:48+00:00,0.0,0.0,rich greedy john dramani mahama,0.258,0.779,0.337,0.75
Voting against #GalamseyKing and #CorruptionKing President Akufo Addo @NAkufoAddo and Voting for #InfrastructureKing John Dramani Mahama @JDMahama #GO4JM2020,1231990161979904004,2020-02-24 17:11:58+00:00,6.0,0.0,voting galamseyking corruptionking president akufo addo USER_MENTION voting infrastructureking john dramani mahama USER_MENTION go4jm2020,0.0,0.0,1.0,0.0
"AG mischievously release GETFUND 2014 auditors report in 2020 just to cover John Dramani Mahama Airbus saga but it’s a lie, Government Official One must speak now",1231914655137849345,2020-02-24 12:11:56+00:00,15.0,3.0,ag mischievously release getfund auditors report cover john dramani mahama airbus saga lie government official one must speak,0.0,0.0,1.0,0.0
Thank u our incoming president John Dramani Mahama. May the good Lord be with u and your team. Victory is assured! ,1231839428659830784,2020-02-24 07:13:00+00:00,4.0,0.0,thank u incoming president john dramani mahama may good lord u team victory assured,0.0,1.1179999999999999,0.582,0.6000000000000001
Let us all come together and support the victory of NDC and John Dramani Mahama in 7 Dec,1231686456277635082,2020-02-23 21:05:09+00:00,0.0,0.0,let us come together support victory ndc john dramani mahama dec,0.0,0.213,0.787,0.0
"Information Minister, Kojo Oppong Nkrumah, has alleged that former President John Dramani Mahama together with former Finance Minister... ",1231588544579112960,2020-02-23 14:36:05+00:00,0.0,0.0,information minister kojo oppong nkrumah alleged former president john dramani mahama together former finance minister,0.03333333333333333,0.0,1.0,0.03333333333333333
"Both Mills and John Dramani Mahama [@JDMahama] added 56% to our electricity generation capacity... If @officeofJJR’s 17% is added, it means the NDC added 73% to our power generation. Sadly, [@NAkufoAddo] is in his fourth year but yet to add a single megawatt to our power",1231484473738452993,2020-02-23 07:42:33+00:00,5.0,3.0,mills john dramani mahama added electricity generation capacity USER_MENTION added means ndc added power generation sadly fourth year yet add single megawatt power,0.14871428571428572,0.0,0.887,0.10714285714285714
Salam Mustapha writes: The tale of two presidents running for the same office: Nana Addo Dankwa Akufo-Addo; give me 4 more to do more. John Dramani Mahama; give me another 4yrs to correct my mistakes. Real incompetent,1231347817207271425,2020-02-22 22:39:31+00:00,0.0,0.0,salam mustapha writes tale two presidents running office nana addo dankwa akufoaddo give john dramani mahama give another correct mistakes real incompetent,0.7439999999999999,0.0,0.781,0.55
Salam Mustapha writes: The tale of two presidents running for the same office: Nana Addo Dankwa Akufo-Addo; give me 4 more to do more. John Dramani Mahama; give me another 4yrs to correct my mistakes.,1231300056608903168,2020-02-22 19:29:44+00:00,26.0,9.0,salam mustapha writes tale two presidents running office nana addo dankwa akufoaddo give john dramani mahama give another correct mistakes,0.116,0.0,0.884,0.0
"Eeeii, Former President John Dramani Mahama 3nti wo “running mate” no nso ay3 boakye bi din? Asem paaa ni. ",1231297231640240128,2020-02-22 19:18:31+00:00,0.0,0.0,eeii former president john dramani mahama wo nso ay3 boakye bi din asem paa ni,0.0,0.0,1.0,0.0
"Eeeii, Former President John Dramani Mahama 3nti wo “running mate” no nso ay3 boakye bi din? Asem paaa ni. #",1231297058994257921,2020-02-22 19:17:49+00:00,0.0,0.0,eeii former president john dramani mahama wo nso ay3 boakye bi din asem paa ni,0.0,0.0,1.0,0.0
"""We now know why Jean Mensah and Bossman was brought to EC"" English from the over 100 NDC MP's. A communication expert, John Dramani Mahama is their leader. #FreeSHSisHere to stay",1231276113118334976,2020-02-22 17:54:36+00:00,3.0,1.0,know jean mensah bossman brought ec english ndc mps communication expert john dramani mahama leader freeshsishere stay,0.0,0.0,1.0,0.0
Some people think Ghana is for them. God never sleeps and would shame the arrogant npp members. Mahama is coming again and to continue his good work. Fellow Ghanaians Mahama was there before and he knows system so let us vote for John Dramani Mahama again! ,1231249935913406466,2020-02-22 16:10:34+00:00,2.0,0.0,people think ghana god never sleeps would shame arrogant npp members mahama coming continue good work fellow ghanaians mahama knows system let us vote john dramani mahama,0.095,0.9239999999999999,0.681,0.6000000000000001
"“Roads in Ghana are in the most terrible state. When you vote for me, I will fix them.”- John Dramani Mahama When you drink alcohol don’t talk",1231238503108947968,2020-02-22 15:25:09+00:00,5.0,1.0,ghana terrible state vote fix john dramani mahama drink alcohol talk,1.237,0.0,0.763,1.0
De vision of JOHN DRAMANI MAHAMA ....NPP toilet ,1231217207209865217,2020-02-22 14:00:31+00:00,6.0,1.0,de vision john dramani mahama npp toilet,0.03333333333333333,0.25,0.75,0.0
De vision John Dramani mahama ....not toilet,1231216910966173702,2020-02-22 13:59:21+00:00,3.0,2.0,de vision john dramani mahama toilet,0.03333333333333333,0.286,0.714,0.0
"President Nana Addo Dankwa Akufo-Addo is taunting his predecessor, John Dramani Mahama, for having ‘no policy’ to campaign on as the 2020 general election gathers momentum. He said Mr. Mahama, who is staging a comeback on the… https://pemsantv.com/visionless-mahama-has-no-policy-akufo-addo-mocks/",1231191504279961601,2020-02-22 12:18:23+00:00,0.0,0.0,president nana addo dankwa akufoaddo taunting predecessor john dramani mahama campaign general election gathers momentum said mr mahama staging comeback URL,0.0,0.05000000000000002,1.0,0.5
John Dramani mahama,1231049880329768966,2020-02-22 02:55:37+00:00,2.0,0.0,john dramani mahama,0.0,0.0,1.0,0.0
"How did a public servant acquire these expensive vehicles . John Dramani Mahama why did you do that . Ghana properties sharing to friends .,what is about a teacher who has been in the classroom for 50 years . Batidam himself is corrupt and thief.",1230894132333367299,2020-02-21 16:36:44+00:00,1.0,0.0,public servant acquire expensive vehicles john dramani mahama ghana properties sharing friends teacher classroom years batidam corrupt thief,0.47333333333333333,0.243,0.617,0.5888888888888889
"The National Youth Organizer of the ruling New Patriotic Party (NPP), Henry Nana Boakye, aka Nana B, has called on former President John Dramani Mahama to apologize for making what he called ‘irresponsible’ comments over the… https://pemsantv.com/nana-b-chides-mahama/",1230883532488265730,2020-02-21 15:54:37+00:00,0.0,0.0,national youth organizer ruling new patriotic party npp henry nana boakye aka nana b called former president john dramani mahama apologize making called comments URL,0.0,0.21918181818181817,0.849,0.22727272727272727
"His Excellency John Dramani Mahama, former President of the Republic of ... https://youtu.be/vg9No6lkUcU via @YouTube",1230863117862817793,2020-02-21 14:33:30+00:00,0.0,0.0,excellency john dramani mahama former president republic URL via USER_MENTION,0.0,0.28,0.72,0.0
JOHN DRAMANI MAHAMA’s CV ON CORRUPTION — ABRONYE DC http://breakingnewsgh.com/john-dramani-mahamas-cv-on-corruption-abronye-dc/,1230846116054405121,2020-02-21 13:25:56+00:00,0.0,0.0,john dramani cv corruption abronye dc URL,0.0,0.0,1.0,0.0
"Ghanaians, DO YOU NOW HAVE MONEY IN YOUR POCKETS for trying the NPP for 4 years? The ultimate is to vote for President John Dramani Mahama as President of the Republic of Ghana in 2020 General Elections.",1230841439044677634,2020-02-21 13:07:21+00:00,0.0,0.0,ghanaians money pockets trying npp years ultimate vote president john dramani mahama president republic ghana general elections,0.0,0.02500000000000001,1.0,0.75
"H. E. Bawumia can laugh like a jackal, but the reality of the Ghanaian economy and politics would catch up with the NPP Government. Lies galore! Vote against NPP in 2020 general elections and Gazette H.E. John Dramani Mahama as President of the Republic of Ghana.",1230840311271829504,2020-02-21 13:02:52+00:00,0.0,0.0,h e bawumia laugh like jackal reality ghanaian economy politics would catch npp government lies galore vote npp general elections gazette h.e john dramani mahama president republic ghana,0.083,0.355,0.737,0.3
"All because of John Dramani Mahama #GovernmentOfficial1 #SayNoToConMahama Airbus Defence and Space to cut more than 2,300 jobs",1230839618511294464,2020-02-21 13:00:07+00:00,1.0,0.0,john dramani mahama governmentofficial1 saynotoconmahama airbus defence space cut jobs,0.183,0.122,0.696,0.0
"President Nana Akufo-Addo has taken a swipe at former President John Dramani Mahama, describing him as someone who wants to return to power to reverse the country’s development. http://bit.ly/3bYROtW",1230834807598276608,2020-02-21 12:41:00+00:00,1.0,2.0,president nana akufoaddo taken swipe former president john dramani mahama describing someone wants return power reverse development URL,0.0,0.1,1.0,0.05
CURRICULUM VITAE (CV) OF JOHN DRAMANI MAHAMA A.K.A GOVERNMENT OFFICIAL 1 (G. O 1) PART 1 http://breakingnewsgh.com/curriculum-vitae-cv-of-john-dramani-mahama-a-k-a-government-official-1-g-o-1-part-1/,1230828225783386113,2020-02-21 12:14:51+00:00,0.0,0.0,curriculum vitae cv john dramani mahama a.k.a government official g part URL,0.0,0.0,1.0,0.0
Vote John Dramani Mahama. ,1230773743804248071,2020-02-21 08:38:21+00:00,0.0,0.0,vote john dramani mahama,0.0,0.0,1.0,0.0
"In 2015 and 2016 you this hypocrite @Sammens sat on vasat one to rubbish john dramani mahama Asphalt Road that you will wake up the next morning you will see in front of ur house road turn to black is this a good road"" this are your words. Hypocrite Man",1230773662766133248,2020-02-21 08:38:02+00:00,0.0,0.0,hypocrite USER_MENTION sat vasat one rubbish john dramani mahama asphalt road wake next morning see front ur house road turn black good road words hypocrite man,0.0,0.2817777777777778,0.896,0.3444444444444445
Were the npp (the who never done wrong) present at the investiture of fmr president John Dramani Mahama on the 7th January 2013 Can somebody ask them for me pls ,1230753582091079680,2020-02-21 07:18:14+00:00,1.0,0.0,npp never done wrong present investiture fmr president john dramani mahama january somebody ask pls,0.25,0.229,0.771,0.45
"Ghana will retrogress if Mahama is re-elected – Akufo-Addo: President Nana Akufo-Addo has taken a swipe at former President John Dramani Mahama, describing him as someone who wants to return to power to reverse the… https://www.instagram.com/p/B80eh7_HJn8/?igshid=di9tgce2m6t6",1230750845366497280,2020-02-21 07:07:22+00:00,0.0,0.0,ghana retrogress mahama reelected akufoaddo president nana akufoaddo taken swipe former president john dramani mahama describing someone wants return power reverse URL,0.0,0.1,1.0,0.05
Mr John Dramani Mahama who was speaking at Sefwi-Debeiso on day two of his Western North tour accused the government of selling fertilizers that were supposed to be freely supplied to the farmers. ,1230738452406124544,2020-02-21 06:18:07+00:00,15.0,1.0,mr john dramani mahama speaking sefwidebeiso day two western north tour accused government selling fertilizers supposed freely supplied farmers,0.1,0.331,0.769,0.4
"John Dramani Mahama, former President and the leader of the opposition National Democratic Congress (NDC), has already started promising... https://is.gd/qatX1y",1230721073097740288,2020-02-21 05:09:04+00:00,0.0,0.0,john dramani mahama former president leader opposition national democratic congress ndc already started promising URL,0.0,0.262,0.838,0.25
John Dramani Mahama is far better than the the self praising Nana Addo. Ghana is bleeding #GalamSONA,1230593479832723464,2020-02-20 20:42:03+00:00,2.0,1.0,john dramani mahama far better self praising nana addo ghana bleeding galamsona,0.0,0.69,0.61,0.75
"- You mocked the health of the late Professor Mills. - You vilified him in Parliament, each time he came to deliver an address on the state of the nation - You boycotted the investiture of John Dramani Mahama - You boycotted 2013 SONA and called Mahama despicable name.",1230556787574595587,2020-02-20 18:16:15+00:00,0.0,0.0,mocked health late professor mills vilified parliament time came deliver address state nation boycotted investiture john dramani mahama boycotted sona called mahama despicable name,0.5680000000000001,0.0,0.732,0.6
How about 1. Motorway interchange 2. Pokuase interchange 3. Obetsebi interchange??? Are they also part of Sinohydro deal? Even in opposition @JDMahama is still developing a developing Ghana.. God bless the womb that gave birth to H.E John Dramani Mahama. #Go4JM #GalamSONA,1230500727304466433,2020-02-20 14:33:29+00:00,7.0,3.0,motorway interchange pokuase interchange obetsebi interchange also part sinohydro deal even opposition USER_MENTION still developing developing ghana god bless womb gave birth h.e john dramani mahama go4jm galamsona,0.0,0.159,0.841,0.0
"Former President and leader of the opposition National Democratic Congress (NDC), Mr John Dramani Mahama has stated that the next NDC government will introduce policies that will improve on the Cocoa production. #GHnewsagency",1230497897751465984,2020-02-20 14:22:15+00:00,8.0,0.0,former president leader opposition national democratic congress ndc mr john dramani mahama stated next ndc government introduce policies improve cocoa production ghnewsagency,0.0,0.121,0.879,0.0
I am not a member of any political party and I am not hear to defend Akufo-Addo. you can’t just create perception. If he is corrupt link him to that corruption and let us take him on . We do know John Dramani Mahama name has been pop up in an international corruption probe,1230493220452302848,2020-02-20 14:03:39+00:00,0.0,0.0,member political party hear defend akufoaddo create perception corrupt link corruption let us take know john dramani mahama name pop international corruption probe,0.16666666666666666,0.186,0.814,0.3666666666666667
"NPP MP's boycotted the inauguration of President John Dramani Mahama on January 7, 2013 what about that?",1230478217762549760,2020-02-20 13:04:02+00:00,0.0,0.0,npp mps boycotted inauguration president john dramani mahama january,0.252,0.0,0.748,0.0
Lies. H.E John Dramani Mahama solved the dumosr problem before leaving office in December 2016. #GalamSONA,1230462334382092288,2020-02-20 12:00:56+00:00,17.0,2.0,lies h.e john dramani mahama solved dumosr problem leaving office december galamsona,0.331,0.127,0.542,0.0
"This old man should stop bragging, @NanaAkuffoAddo please can't you keep quiet for a minute and stop those unnecessary promises. Better consult @JohnDramaniMahama for his natural wisdom on how to successful govern a country and stop using your book long tricks. AkuffoAddo Npp",1230460936806391810,2020-02-20 11:55:22+00:00,0.0,0.0,old man stop bragging USER_MENTION please cant keep quiet minute stop unnecessary promises better consult USER_MENTION natural wisdom successful govern country stop using book long tricks akuffoaddo npp,0.186,0.5438571428571428,0.413,0.5261904761904762
So Former President John Dramani Mahama didnt attend #SONA while the wives of late President Mill and Vice Amisah Arthur were present.,1230448655666208768,2020-02-20 11:06:34+00:00,1.0,0.0,former president john dramani mahama didnt attend sona wives late president mill vice amisah arthur present,0.09999999999999999,0.0,1.0,0.19999999999999998
The Immediate past President iz missing out of Parliament. Hiz excellency the forma President #JohnDramaniMahama,1230445464283238401,2020-02-20 10:53:53+00:00,0.0,0.0,immediate past president iz missing parliament hiz excellency forma president johndramanimahama,0.375,0.238,0.612,0.15
"BREAKING NEWS : NDC presidential candidate, John Dramani Mahama has instructed NDC minority in parliament to leave their jobs in parliament just because he (John Mahama ) doesn’t want a new voters register.",1230443403743244288,2020-02-20 10:45:42+00:00,42.0,8.0,breaking news ndc presidential candidate john dramani mahama instructed ndc minority parliament leave jobs parliament john mahama want new voters register,0.056,0.19636363636363635,0.884,0.45454545454545453
John Dramani Mahama can't take moral lessons from a brothel #GalamSONA,1230416869913452544,2020-02-20 09:00:16+00:00,0.0,1.0,john dramani mahama cant take moral lessons brothel galamsona,0.0,0.0,1.0,0.25
"https://www.facebook.com/1507330272890877/posts/2392315321059030/ Listen to the verdict from the man on the street. The taxi driver who was promised heaven by Akuffo Addo in 2016. We shall change this bad change. We want our John Mahama back. December 07, 2020, we're all voting for John Dramani Mahama. #GalamSONA",1230401020385275905,2020-02-20 07:57:17+00:00,0.0,0.0,URL listen verdict man street taxi driver promised heaven akuffo addo shall change bad change want john mahama back december voting john dramani mahama galamsona,0.4589999999999999,0.27,0.621,0.3333333333333333
"John Mahama bemoans state of Benchema- Oseikojokrom road —- The flagbearer of the National Democratic Congress (NDC), John Dramani Mahama, has bemoaned the state of the Benchema- Oseikojokrom road in the Western North Region. #speakout",1230262002087550976,2020-02-19 22:44:53+00:00,54.0,14.0,john mahama bemoans state benchema oseikojokrom road flagbearer national democratic congress ndc john dramani mahama bemoaned state benchema oseikojokrom road western north region speakout,0.0,0.0,1.0,0.0
I assure John Dramani Mahama there will be no chaos come December 7th says Nana Addo,1230251008208576512,2020-02-19 22:01:11+00:00,0.0,0.0,assure john dramani mahama chaos come december says nana addo,0.262,0.17,0.567,0.0
"HIS EXCELLENCY JOHN DRAMANI MAHAMA, LIKE STARS ON EARTH* John Dramani Mahama is a humble honest man who is known by all and sundry across the length and breadth of the country Ghana and beyond. He carved an enviable niche...",1230135101629005827,2020-02-19 14:20:37+00:00,1.0,0.0,excellency john dramani mahama like stars john dramani mahama humble honest man known sundry across length breadth country ghana beyond carved enviable niche,0.0,0.517,0.683,0.65
"HIS EXCELLENCY JOHN DRAMANI MAHAMA, LIKE STARS ON EARTH John Dramani Mahama is a humble honest man who is known by all and sundry across the length and breadth of the country Ghana and beyond. He carved an enviable niche for himself and gained lots of admirable...",1230128760822943744,2020-02-19 13:55:25+00:00,0.0,0.0,excellency john dramani mahama like stars earth john dramani mahama humble honest man known sundry across length breadth country ghana beyond carved enviable niche gained lots admirable,0.0,0.613,0.587,0.65
Former Minister of Communications Dr. Edward Omane Boamah says Ex-President John Dramani Mahama invested heavily in pharmaceutical... https://is.gd/Gz4JAe,1230087909048369153,2020-02-19 11:13:06+00:00,0.0,0.0,former minister communications dr edward omane boamah says expresident john dramani mahama invested heavily pharmaceutical URL,0.1,0.0,1.0,0.25
"When it comes to unleashing violence, nobody can beat ndc” - John Dramani Mahama “If EC compiles new voters register, there will be war in Ghana” - A former Assemblyman A for MP A former Deputy Minister A former Minister A former Vice President A former President ",1230059398074183680,2020-02-19 09:19:48+00:00,2.0,0.0,comes unleashing violence nobody beat john dramani mahama ec compiles new voters register war former assemblyman mp former deputy minister former minister former vice president former president,0.242,0.022727272727272724,0.758,0.07575757575757576
"Member of Parliament (MP) for Assin Central, Kennedy Agyapong has described comments from former President John Dramani Mahama regarding... https://is.gd/uYxrLJ",1230043358988423168,2020-02-19 08:16:04+00:00,0.0,0.0,member parliament mp assin central kennedy agyapong described comments former president john dramani mahama regarding URL,0.0,0.0,1.0,0.125
"Let's change this NPP government. Vote for John Dramani Mahama #December, 2020",1230010392417591296,2020-02-19 06:05:04+00:00,0.0,0.0,lets change npp government vote john dramani mahama december,0.0,0.0,1.0,0.0
"Mr. John Dramani Mahama never raised a single finger or even a single stone in the official corruption fight, he simply led the charge... https://is.gd/QHmAjs",1229979446326644736,2020-02-19 04:02:06+00:00,0.0,0.0,mr john dramani mahama never raised single finger even single stone official corruption fight simply led charge URL,0.18061904761904762,0.0,0.867,0.2619047619047619
John Dramani Mahama.....,1229916460010672133,2020-02-18 23:51:49+00:00,0.0,0.0,john dramani mahama,0.0,0.0,1.0,0.0
On-Tuesday-the-flagbearer-of-the-National-Democratic-Congress-NDC-Mr-John-Dramani-Mahama-begun-a-three-day-working-visit-to-the-Western-N... ,1229907466210512896,2020-02-18 23:16:05+00:00,0.0,0.0,ontuesdaytheflagbearerofthenationaldemocraticcongressndcmrjohndramanimahamabegunathreedayworkingvisittothewesternn,0.0,0.0,1.0,0.0
The-Omanhene-of-Awaso-Asempaneye-Nana-Oko-Twansuo-III-has-commended-former-President-John-Dramani-Mahama-and-the-National-Democratic-Cong... https://is.gd/yUAWyR,1229900671370981376,2020-02-18 22:49:05+00:00,0.0,0.0,theomanheneofawasoasempaneyenanaokotwansuoiihascommendedformerpresidentjohndramanimahamaandthenationaldemocraticcong URL,0.0,0.0,1.0,0.0
"The Omanhene of Awaso Asempaneye, Nana Oko Twansuo III, has commended former President John Dramani Mahama and the National Democratic... https://is.gd/gZUexj",1229891870588719104,2020-02-18 22:14:06+00:00,0.0,0.0,omanhene awaso asempaneye nana oko twansuo ii commended former president john dramani mahama national democratic URL,0.0,0.162,0.838,0.0
"From NDC presidential aspirant John Dramani Mahama through their hierarchy in downwards spiral to Sammy Gyamfi and Anita de Souso,... https://is.gd/VKEuOT",1229884571199533056,2020-02-18 21:45:06+00:00,0.0,0.0,ndc presidential aspirant john dramani mahama hierarchy downwards spiral sammy gyamfi anita de souso URL,0.0,0.0,1.0,0.0
"The Omanhene of Awaso Asempaneye, Nana Oko Twansuo III, has commended former President John Dramani Mahama and the National Democratic... https://is.gd/dmazHq",1229874507378151424,2020-02-18 21:05:07+00:00,0.0,0.0,omanhene awaso asempaneye nana oko twansuo ii commended former president john dramani mahama national democratic URL,0.0,0.162,0.838,0.0
"The Omanhene of Awaso Asempaneye, Nana Oko Twansuo III, has commended former President John Dramani Mahama and the National Democratic... https://is.gd/p7rbaK",1229867195359846400,2020-02-18 20:36:03+00:00,0.0,0.0,omanhene awaso asempaneye nana oko twansuo ii commended former president john dramani mahama national democratic URL,0.0,0.162,0.838,0.0
"Show me one of your favorite pictures of him; John Dramani Mahama [@JDMahama], the next President of Ghana. #SpeakOut",1229863022237224966,2020-02-18 20:19:28+00:00,57.0,14.0,show one favorite pictures john dramani mahama next president ghana speakout,0.0,0.481,0.769,0.5
#SpeakOut : Ghana's Incoming President HE John Dramani Mahama is listening.... ,1229851382582333441,2020-02-18 19:33:13+00:00,23.0,5.0,speakout ghanas incoming president john dramani mahama listening,0.0,0.0,1.0,0.0
"The Omanhene of Awaso Asempaneye, Nana Oko Twansuo III, has commended former President John Dramani Mahama and the National Democratic... https://is.gd/okMVAD",1229851097667235842,2020-02-18 19:32:05+00:00,0.0,0.0,omanhene awaso asempaneye nana oko twansuo ii commended former president john dramani mahama national democratic URL,0.0,0.162,0.838,0.0
"According to President Akufo-Addo, at the time, the President of the Republic, His Excellency John Dramani Mahama, met the agitation of over the register with the following words:",1229850783862153216,2020-02-18 19:30:51+00:00,0.0,0.0,according president akufoaddo time president republic excellency john dramani mahama met agitation register following words,0.108,0.189,0.703,0.1
#SpeakOut : Ghana's Incoming President HE John Dramani Mahama is listening.... @joyce_bawah @StanDogbe @eomaneboamah @AgboDyer,1229849920791773185,2020-02-18 19:27:25+00:00,0.0,0.0,speakout ghanas incoming president john dramani mahama listening USER_MENTION USER_MENTION USER_MENTION USER_MENTION,0.0,0.0,1.0,0.0
"The Omanhene of Awaso Asempaneye, Nana Oko Twansuo III, has commended former President John Dramani Mahama and the National Democratic Congress (NDC) for the massive development projects across the country... http://dlvr.it/RQHKT1",1229835287729229825,2020-02-18 18:29:16+00:00,0.0,0.0,omanhene awaso asempaneye nana oko twansuo ii commended former president john dramani mahama national democratic congress ndc massive development projects across country URL,0.0,0.116,0.884,0.5
