tweets,id,date,likes,retweets,clean_tweet,sentiment_negative,sentiment_positive,sentiment_neutral,subjectivity
The fact of the matter is that the entire John Dramani Mahama-chaperoned leadership of the National Democratic Congress (NDC) has... https://is.gd/NUWkXE,1233836109169352704,2020-02-29 19:27:06+00:00,0.0,0.0,fact matter entire john dramani mahamachaperoned leadership national democratic congress ndc URL,0.0,0.091,0.909,0.625
#GalamSONA RT SamYoun42: Arrival of H. E. John Dramani Mahama in Tuobodom today. #SpeakOut JDMahama BigDaddyCee7 SamToys_NPP NatTettehGhana alexkmould Dorsty1R ndccommbureau NDC20202 OfficialNDCGh officialNDCusa FelixKwakyeOfo1 Id_abdulrazak,1233671325778153473,2020-02-29 08:32:19+00:00,6.0,3.0,galamsona samyoun42 arrival h e john dramani mahama tuobodom today speakout jdmahama bigdaddycee7 samtoys_npp nattettehghana alexkmould dorsty1r ndccommbureau ndc20202 officialndcgh officialndcusa felixkwakyeofo1 id_abdulrazak,0.0,0.0,1.0,0.0
#GalamSONA #SONA2020 RT SamYoun42: Arrival of H. E. John Dramani Mahama in Tuobodom today. #SpeakOut JDMahama BigDaddyCee7 SamToys_NPP NatTettehGhana alexkmould Dorsty1R ndccommbureau NDC20202 OfficialNDCGh officialNDCusa FelixKwakyeOfo1 Id_abdulrazak,1233664010207268864,2020-02-29 08:03:15+00:00,1.0,0.0,galamsona sona2020 samyoun42 arrival h e john dramani mahama tuobodom today speakout jdmahama bigdaddycee7 samtoys_npp nattettehghana alexkmould dorsty1r ndccommbureau ndc20202 officialndcgh officialndcusa felixkwakyeofo1 id_abdulrazak,0.0,0.0,1.0,0.0
"That's the peace loving man I've been convincing people to vote for Him come 7th December 2020. He's not arrogant, not wicked, not insensitive, not corrupt but, respectful, humble & affable. His Excellency John Dramani Mahama is Tried &amp; Tested, very Trust worthy. Insha Allah ",1233505304744267784,2020-02-28 21:32:36+00:00,1.0,0.0,thats peace loving man ive convincing people vote come december hes arrogant wicked insensitive corrupt respectful humble affable excellency john dramani mahama tried tested trust worthy insha allah,0.172,0.7524761904761905,0.365,0.8642857142857144
The Flagbearer of the National Democratic Congress (NDC) John Dramani Mahama on Thursday joined the chiefs and people of Tuobodom and... ,1233453074473074689,2020-02-28 18:05:04+00:00,0.0,0.0,flagbearer national democratic congress ndc john dramani mahama thursday joined chiefs people tuobodom,0.0,0.0,1.0,0.0
https://mobile.ghanaweb.com/GhanaHomePage/NewsArchive/Akufo-Addo-has-failed-kick-him-out-Mahama-tells-Ghanaians-880927 Former president John Dramani Mahama has chided President Nana Akufo-Addo saying he has failed Ghanaians after lofty promises during the 2016 electioneering campaign hence Ghanaians needs to vote him out in the 2020 general elections.,1233452211914596358,2020-02-28 18:01:38+00:00,1.0,0.0,URL former president john dramani mahama chided president nana akufoaddo saying failed ghanaians lofty promises electioneering campaign hence ghanaians needs vote general elections,0.273,0.097,0.781,0.26666666666666666
Former President John Dramani Mahama mourns the Late Queen Mother of Tuobodom @OfficialNDCGh @ndccommbureau,1233387720677916673,2020-02-28 13:45:22+00:00,2.0,0.0,former president john dramani mahama mourns late queen mother tuobodom USER_MENTION USER_MENTION,0.386,0.0,0.764,0.3
Former president John Dramani Mahama has taken a dig at the governing New Patriotic Party and President Nana Akufo-Addo. ,1233362674685075456,2020-02-28 12:05:51+00:00,0.0,0.0,former president john dramani mahama taken dig governing new patriotic party president nana akufoaddo,0.0,0.24018181818181816,0.828,0.22727272727272727
Nana Addo has nothing more to offer Ghanaians – John Dramani Mahama https://ghreporter.com/nana-addo-has-nothing-more-to-offer-ghanaians-john-dramani-mahama/,1233355919569948673,2020-02-28 11:39:00+00:00,0.0,0.0,nana addo nothing offer ghanaians john dramani mahama URL,0.0,0.0,1.0,0.0
I completed school 2014...and as at that time the day students were schooling for free under the regime of Former president John Dramani Mahama.....Indeed is true that he started free SHS.....the issue is he weren't praises him self over this...because is his duty,1233318554256146434,2020-02-28 09:10:31+00:00,0.0,0.0,completed school time day students schooling free regime former president john dramani mahama indeed true started free shs issue werent praises self duty,0.089,0.5894999999999999,0.609,0.5625
Ashock bro I completed school 2014...and as at that time the students were schooling for free under the regime of Former president John Dramani Mahama.....Indeed is true that he started free SHS,1233317440131604481,2020-02-28 09:06:06+00:00,1.0,0.0,ashock bro completed school time students schooling free regime former president john dramani mahama indeed true started free shs,0.0,0.6575,0.63,0.5625
The Flagbearer of the National Democratic Congress (NDC) John Dramani Mahama on Thursday joined the chiefs and people of Tuobodom and other sympathisers to pay his las respect and mourn with the family of the late Queenmother of Tuobodom Nana Afia Fosuaa. ,1233314486406254592,2020-02-28 08:54:22+00:00,5.0,0.0,flagbearer national democratic congress ndc john dramani mahama thursday joined chiefs people tuobodom sympathisers pay las respect mourn family late queenmother tuobodom nana afia fosuaa,0.44299999999999995,0.106,0.751,0.6
“I started free SHS policy” – John Dramani Mahama ,1233310275069206529,2020-02-28 08:37:38+00:00,0.0,0.0,started free shs john dramani mahama,0.0,0.798,0.602,0.8
“I started free SHS policy” – John Dramani Mahama https://xorlali.com/2020/02/i-started-free-shs-policy-mahama/,1233309932927299585,2020-02-28 08:36:16+00:00,0.0,0.0,started free shs john dramani mahama URL,0.0,0.755,0.645,0.8
"#4MoreToStealMore RT StanDogbe: Agya Ntow, a cocoa farmer from Kasapin, speaking at a Community and Farmers Durbar on Wednesday as part of a #SpeakOut tour of the Ahafo Region by the Flagbearer of the National Democratic Congress, John Dramani Mahama. ",1233305441825890304,2020-02-28 08:18:25+00:00,0.0,0.0,standogbe agya ntow cocoa farmer kasapin speaking community farmers durbar wednesday part speakout tour ahafo region flagbearer national democratic congress john dramani mahama,0.0,0.0,1.0,0.0
"The Founder and leader of the Liberal Party of Ghana (LPG), Percival Kofi Akpaloo, has fired former President John Dramani Mahama once... https://is.gd/8YlMPY",1233228861099278337,2020-02-28 03:14:07+00:00,0.0,0.0,founder leader liberal party ghana lpg percival kofi akpaloo fired former president john dramani mahama URL,0.177,0.133,0.69,0.0
"@owusukw1 Arrival of Former President of the Republic of Ghana, John Dramani Mahama in Tuobodom today. #SpeakOut",1233146856508678145,2020-02-27 21:48:16+00:00,3.0,0.0,USER_MENTION arrival former president republic ghana john dramani mahama tuobodom today speakout,0.0,0.0,1.0,0.0
Arrival of H. E. John Dramani Mahama in Tuobodom today. #SpeakOut @JDMahama @BigDaddyCee7 @SamToys_NPP @NatTettehGhana @alexkmould @Dorsty1R @ndccommbureau @NDC20202 @OfficialNDCGh @officialNDCusa @FelixKwakyeOfo1 @Id_abdulrazak,1233137868563865601,2020-02-27 21:12:33+00:00,24.0,6.0,arrival h e john dramani mahama tuobodom today speakout USER_MENTION USER_MENTION USER_MENTION USER_MENTION USER_MENTION USER_MENTION USER_MENTION USER_MENTION USER_MENTION USER_MENTION USER_MENTION USER_MENTION,0.0,0.0,1.0,0.0
When former President John Dramani Mahama said he had inherited a legacy problem in the power sector and that he wasn rsquo;t going to... https://is.gd/5v18G5,1233133225981050881,2020-02-27 20:54:06+00:00,0.0,0.0,former president john dramani mahama said inherited legacy problem power sector going URL,0.184,0.0,0.816,0.0
HIS EXCELLENCY JOHN DRAMANI MAHAMA because he feels the way we feel,1233069283640594433,2020-02-27 16:40:01+00:00,2.0,0.0,excellency john dramani mahama feels way feel,0.0,0.368,0.632,0.0
Former President John Dramani Mahama has made an astonishing claim to the effect that he brought about the now highly acclaimed Free Senior High School (SHS) policy — one of the flagship initiatives of the Akufo-Addo administration. http://bit.ly/2vlGdEY,1233065715462287366,2020-02-27 16:25:50+00:00,0.0,1.0,former president john dramani mahama made astonishing claim effect brought highly acclaimed free senior high school shs policy one flagship initiatives akufoaddo administration URL,0.0,0.429,0.815,0.576
Former President John Dramani Mahama has made an astonishing claim to the effect that he brought about the now highly acclaimed Free Senior High School (SHS) policy — one of the flagship initiatives of the Akufo-Addo administration. #Freeshs #PresidentJo https://www.ghbreakingnews.com/i-brought-free-shs-mahama-claims/,1233041898367016960,2020-02-27 14:51:12+00:00,1.0,2.0,former president john dramani mahama made astonishing claim effect brought highly acclaimed free senior high school shs policy one flagship initiatives akufoaddo administration freeshs presidentjo URL,0.0,0.416,0.828,0.576
"WE WILL SUPPORT MAHAMA TO WIN ELECTION 2020 – SENCHIEMHENE Chief of Sienchiem, a town in the Ahafo Region has pledged the support of his people to ensure a win for Flagbearer of the NDC, John Dramani Mahama in the 2020 elections. https://www.ghanaquest.com/we-will-support-mahama-to-win-election-2020-senchiemhane/",1233023376966504451,2020-02-27 13:37:36+00:00,2.0,0.0,support mahama win election senchiemhene chief sienchiem town ahafo region pledged support people ensure win flagbearer ndc john dramani mahama elections URL,0.0,1.279,0.521,0.4
"Ashanti Kingdom: ManhyiaPalace ""Former President John Dramani Mahama JDMahama at the occasion. "" #Exploregh #Ashanti #Kumasi #VisitKumasi",1232948112525754368,2020-02-27 08:38:31+00:00,0.0,1.0,ashanti kingdom manhyiapalace former president john dramani mahama jdmahama occasion exploregh ashanti kumasi visitkumasi,0.0,0.0,1.0,0.0
"You fear the return of DUMSOR, yet u are clamouring for the return of John Dramani Mahama , you need deliverance!!",1232939073700028416,2020-02-27 08:02:36+00:00,4.0,0.0,fear return dumsor yet u clamouring return john dramani mahama need deliverance,0.225,0.0,0.775,0.0
"Agya Ntow, a cocoa farmer from Kasapin, speaking at a Community and Farmers Durbar on Wednesday as part of a #SpeakOut tour of the Ahafo Region by the Flagbearer of the National Democratic Congress, John Dramani Mahama. ",1232937294438522880,2020-02-27 07:55:32+00:00,23.0,8.0,agya ntow cocoa farmer kasapin speaking community farmers durbar wednesday part speakout tour ahafo region flagbearer national democratic congress john dramani mahama,0.0,0.0,1.0,0.0
"MAHAMA TOURS AHAFO REGION: Fomer president of Ghana and Flagbearer of the NDC, John Dramani Mahama is continuing with the party's SpeakOut Tour in the Ahafo Region. Find out more here. The post MAHAMA TOURS AHAFO REGION appeared first on Ghana Quest. ",1232924834943758336,2020-02-27 07:06:01+00:00,0.0,0.0,mahama tours ahafo region fomer president ghana flagbearer ndc john dramani mahama continuing partys speakout tour ahafo region find post mahama tours ahafo region appeared first ghana quest,0.0,0.25,1.0,0.3333333333333333
"This is not the first time mps has been boycotting from the Parliament. NPP think Ghana is for them as Ursala Owusu Ekuful and Nana Addo claims. Ghanaians should not disappoint me, they should round behind me and vote for John Dramani Mahama upcoming election 2020.",1232923929238495238,2020-02-27 07:02:26+00:00,0.0,0.0,first time mps boycotting parliament npp think ghana ursala owusu ekuful nana addo claims ghanaians disappoint round behind vote john dramani mahama upcoming election,0.3136666666666667,0.0,0.803,0.4777777777777778
Former President John Dramani Mahama @JDMahama at the occasion.,1232727903701553152,2020-02-26 18:03:29+00:00,26.0,4.0,former president john dramani mahama USER_MENTION occasion,0.0,0.0,1.0,0.0
"John Dramani Mahama, the ex-president and flagbearer of the National Democratic Congress (NDC) turns 61 years last year. He was born to Emmanuel Adama Mahama, a politician and a rice farmer in Damango in the Savannah Region.#Ghana",1232682050341175296,2020-02-26 15:01:17+00:00,1.0,1.0,john dramani mahama expresident flagbearer national democratic congress ndc turns years last year born emmanuel adama mahama politician rice farmer damango savannah region ghana,0.0,0.0,1.0,0.06666666666666667
#GalamSONA #SONA2020 #TheUselessOne Live scenes from the Bono Region... John Dramani Mahama cares and he wants to hear from you. #SpeakOut,1232578633878904833,2020-02-26 08:10:21+00:00,1.0,0.0,galamsona sona2020 theuselessone live scenes bono region john dramani mahama cares wants hear speakout,0.0,0.35618181818181816,0.812,0.3
President John Dramani Mahama #RescueMission,1232556544824414208,2020-02-26 06:42:34+00:00,1.0,1.0,president john dramani mahama rescuemission,0.0,0.0,1.0,0.0
Photo from Bewin Yakubu Mayonu President John Dramani Mahama #RescueMission,1232553886260637697,2020-02-26 06:32:00+00:00,2.0,0.0,photo bewin yakubu mayonu president john dramani mahama rescuemission,0.0,0.0,1.0,0.0
President John Dramani Mahama #RescueMission,1232542294978551810,2020-02-26 05:45:57+00:00,1.0,1.0,president john dramani mahama rescuemission,0.0,0.0,1.0,0.0
President John Dramani Mahama #RescueMission,1232453017850413056,2020-02-25 23:51:11+00:00,2.0,1.0,president john dramani mahama rescuemission,0.0,0.0,1.0,0.0
President John Dramani Mahama #RescueMission,1232436584521162752,2020-02-25 22:45:53+00:00,0.0,0.0,president john dramani mahama rescuemission,0.0,0.0,1.0,0.0
President John Dramani Mahama #RescueMisson #TrustTheProcess,1232436348507738113,2020-02-25 22:44:57+00:00,0.0,0.0,president john dramani mahama rescuemisson trusttheprocess,0.0,0.0,1.0,0.0
President John Dramani Mahama #RescueMission,1232436250230935553,2020-02-25 22:44:34+00:00,4.0,1.0,president john dramani mahama rescuemission,0.0,0.0,1.0,0.0
President John Dramani Mahama #RescueMission #TrustTheProcess,1232435948429824000,2020-02-25 22:43:22+00:00,0.0,0.0,president john dramani mahama rescuemission trusttheprocess,0.0,0.0,1.0,0.0
President John Dramani Mahama #RescueMission,1232433438734471168,2020-02-25 22:33:23+00:00,4.0,1.0,president john dramani mahama rescuemission,0.0,0.0,1.0,0.0
President John Dramani Mahama #RescueMission,1232432146943365120,2020-02-25 22:28:15+00:00,1.0,1.0,president john dramani mahama rescuemission,0.0,0.0,1.0,0.0
President John Dramani Mahama #RescueMission,1232429799894855680,2020-02-25 22:18:56+00:00,0.0,0.0,president john dramani mahama rescuemission,0.0,0.0,1.0,0.0
President John Dramani Mahama #RescueMission @JDMahama @KokuNanegbe @Id_abdulrazak @BigDaddyCee7 @OfficialNDCGh @NDCChangeAgenda @NPP_GH,1232429686334148608,2020-02-25 22:18:29+00:00,3.0,0.0,president john dramani mahama rescuemission USER_MENTION USER_MENTION USER_MENTION USER_MENTION USER_MENTION USER_MENTION USER_MENTION,0.0,0.0,1.0,0.0
President John Dramani Mahama #RescueMission,1232429501788884993,2020-02-25 22:17:45+00:00,1.0,0.0,president john dramani mahama rescuemission,0.0,0.0,1.0,0.0
But this happened under the NDC government superintended by the INCOMPETENT John Dramani Mahama alias Dead Goat.,1232420625714679810,2020-02-25 21:42:29+00:00,1.0,1.0,happened ndc government superintended incompetent john dramani mahama alias dead goat,0.726,0.0,0.549,0.38333333333333336
"A new nation shall be discovered, it is sacred and the god king is on his way to lead his people to the promise land, He is the divine promise, John Dramani Mahama the descendant of the preseved History, not the mirage we are seeing today. So pray and keep vigil",1232364704787464193,2020-02-25 18:00:16+00:00,0.0,0.0,new nation shall discovered sacred god king way lead people promise land divine promise john dramani mahama descendant preseved history mirage seeing today pray keep vigil,0.0,0.5113636363636364,0.625,0.45454545454545453
Live scenes from the Bono Region... John Dramani Mahama cares and he wants to hear from you. #SpeakOut,1232363463512666112,2020-02-25 17:55:20+00:00,8.0,4.0,live scenes bono region john dramani mahama cares wants hear speakout,0.0,0.3991818181818182,0.769,0.3
"*John Mahama tours Ahafo Region* The Flagbearer of the National Democratic Congress (NDC), John Dramani Mahama, on Tuesday began a three-day working visit of the Ahafo Region. The tour, which started from the Western North Region, has been dubbed #SpeakOut. @JDMahama",1232356755931357190,2020-02-25 17:28:41+00:00,5.0,2.0,mahama tours ahafo flagbearer national democratic congress ndc john dramani mahama tuesday began threeday working visit ahafo region tour started western north region dubbed speakout USER_MENTION,0.0,0.0,1.0,0.0
"*John Mahama tours Ahafo Region* The Flagbearer of the National Democratic Congress (NDC), John Dramani Mahama, on Tuesday began a three-day working visit of the Ahafo Region. The tour, which started from the Western North Region, has been dubbed #SpeakOut.",1232296774037049344,2020-02-25 13:30:20+00:00,23.0,10.0,mahama tours ahafo flagbearer national democratic congress ndc john dramani mahama tuesday began threeday working visit ahafo region tour started western north region dubbed speakout,0.0,0.0,1.0,0.0
John Dramani Mahama will be winning upcoming election 2020 ,1232235585663836160,2020-02-25 09:27:12+00:00,0.0,0.0,john dramani mahama winning upcoming election,0.0,0.905,0.595,0.75
Wining 2020 election is starting from today. Voting John Dramani Mahama is a vote for development,1232207634213855232,2020-02-25 07:36:07+00:00,0.0,0.0,wining election starting today voting john dramani mahama vote development,0.0,0.0,1.0,0.1
"And Former President J.A.Kuffour said unto the flag bearer of NDC (JOHN DRAMANI MAHAMA) worry not, you will surely win this year's election. #Am4JM #RescueMission",1232199898096902150,2020-02-25 07:05:23+00:00,10.0,0.0,former president j.a.kuffour said unto flag bearer ndc john dramani mahama worry surely win years election am4jm rescuemission,0.118,0.672,0.61,0.2
Rich but greedy John Dramani Mahama,1232078199934324740,2020-02-24 23:01:48+00:00,0.0,0.0,rich greedy john dramani mahama,0.258,0.779,0.337,0.75
Voting against #GalamseyKing and #CorruptionKing President Akufo Addo @NAkufoAddo and Voting for #InfrastructureKing John Dramani Mahama @JDMahama #GO4JM2020,1231990161979904004,2020-02-24 17:11:58+00:00,6.0,0.0,voting galamseyking corruptionking president akufo addo USER_MENTION voting infrastructureking john dramani mahama USER_MENTION go4jm2020,0.0,0.0,1.0,0.0
"AG mischievously release GETFUND 2014 auditors report in 2020 just to cover John Dramani Mahama Airbus saga but it’s a lie, Government Official One must speak now",1231914655137849345,2020-02-24 12:11:56+00:00,15.0,3.0,ag mischievously release getfund auditors report cover john dramani mahama airbus saga lie government official one must speak,0.0,0.0,1.0,0.0
Thank u our incoming president John Dramani Mahama. May the good Lord be with u and your team. Victory is assured! ,1231839428659830784,2020-02-24 07:13:00+00:00,4.0,0.0,thank u incoming president john dramani mahama may good lord u team victory assured,0.0,1.1179999999999999,0.582,0.6000000000000001
Let us all come together and support the victory of NDC and John Dramani Mahama in 7 Dec,1231686456277635082,2020-02-23 21:05:09+00:00,0.0,0.0,let us come together support victory ndc john dramani mahama dec,0.0,0.213,0.787,0.0
"Information Minister, Kojo Oppong Nkrumah, has alleged that former President John Dramani Mahama together with former Finance Minister... ",1231588544579112960,2020-02-23 14:36:05+00:00,0.0,0.0,information minister kojo oppong nkrumah alleged former president john dramani mahama together former finance minister,0.03333333333333333,0.0,1.0,0.03333333333333333
"Both Mills and John Dramani Mahama [@JDMahama] added 56% to our electricity generation capacity... If @officeofJJR’s 17% is added, it means the NDC added 73% to our power generation. Sadly, [@NAkufoAddo] is in his fourth year but yet to add a single megawatt to our power",1231484473738452993,2020-02-23 07:42:33+00:00,5.0,3.0,mills john dramani mahama added electricity generation capacity USER_MENTION added means ndc added power generation sadly fourth year yet add single megawatt power,0.14871428571428572,0.0,0.887,0.10714285714285714
Salam Mustapha writes: The tale of two presidents running for the same office: Nana Addo Dankwa Akufo-Addo; give me 4 more to do more. John Dramani Mahama; give me another 4yrs to correct my mistakes. Real incompetent,1231347817207271425,2020-02-22 22:39:31+00:00,0.0,0.0,salam mustapha writes tale two presidents running office nana addo dankwa akufoaddo give john dramani mahama give another correct mistakes real incompetent,0.7439999999999999,0.0,0.781,0.55
Salam Mustapha writes: The tale of two presidents running for the same office: Nana Addo Dankwa Akufo-Addo; give me 4 more to do more. John Dramani Mahama; give me another 4yrs to correct my mistakes.,1231300056608903168,2020-02-22 19:29:44+00:00,26.0,9.0,salam mustapha writes tale two presidents running office nana addo dankwa akufoaddo give john dramani mahama give another correct mistakes,0.116,0.0,0.884,0.0
"Eeeii, Former President John Dramani Mahama 3nti wo “running mate” no nso ay3 boakye bi din? Asem paaa ni. ",1231297231640240128,2020-02-22 19:18:31+00:00,0.0,0.0,eeii former president john dramani mahama wo nso ay3 boakye bi din asem paa ni,0.0,0.0,1.0,0.0
"Eeeii, Former President John Dramani Mahama 3nti wo “running mate” no nso ay3 boakye bi din? Asem paaa ni. #",1231297058994257921,2020-02-22 19:17:49+00:00,0.0,0.0,eeii former president john dramani mahama wo nso ay3 boakye bi din asem paa ni,0.0,0.0,1.0,0.0
"""We now know why Jean Mensah and Bossman was brought to EC"" English from the over 100 NDC MP's. A communication expert, John Dramani Mahama is their leader. #FreeSHSisHere to stay",1231276113118334976,2020-02-22 17:54:36+00:00,3.0,1.0,know jean mensah bossman brought ec english ndc mps communication expert john dramani mahama leader freeshsishere stay,0.0,0.0,1.0,0.0
Some people think Ghana is for them. God never sleeps and would shame the arrogant npp members. Mahama is coming again and to continue his good work. Fellow Ghanaians Mahama was there before and he knows system so let us vote for John Dramani Mahama again! ,1231249935913406466,2020-02-22 16:10:34+00:00,2.0,0.0,people think ghana god never sleeps would shame arrogant npp members mahama coming continue good work fellow ghanaians mahama knows system let us vote john dramani mahama,0.095,0.9239999999999999,0.681,0.6000000000000001
"“Roads in Ghana are in the most terrible state. When you vote for me, I will fix them.”- John Dramani Mahama When you drink alcohol don’t talk",1231238503108947968,2020-02-22 15:25:09+00:00,5.0,1.0,ghana terrible state vote fix john dramani mahama drink alcohol talk,1.237,0.0,0.763,1.0
De vision of JOHN DRAMANI MAHAMA ....NPP toilet ,1231217207209865217,2020-02-22 14:00:31+00:00,6.0,1.0,de vision john dramani mahama npp toilet,0.03333333333333333,0.25,0.75,0.0
De vision John Dramani mahama ....not toilet,1231216910966173702,2020-02-22 13:59:21+00:00,3.0,2.0,de vision john dramani mahama toilet,0.03333333333333333,0.286,0.714,0.0
"President Nana Addo Dankwa Akufo-Addo is taunting his predecessor, John Dramani Mahama, for having ‘no policy’ to campaign on as the 2020 general election gathers momentum. He said Mr. Mahama, who is staging a comeback on the… https://pemsantv.com/visionless-mahama-has-no-policy-akufo-addo-mocks/",1231191504279961601,2020-02-22 12:18:23+00:00,0.0,0.0,president nana addo dankwa akufoaddo taunting predecessor john dramani mahama campaign general election gathers momentum said mr mahama staging comeback URL,0.0,0.05000000000000002,1.0,0.5
John Dramani mahama,1231049880329768966,2020-02-22 02:55:37+00:00,2.0,0.0,john dramani mahama,0.0,0.0,1.0,0.0
"How did a public servant acquire these expensive vehicles . John Dramani Mahama why did you do that . Ghana properties sharing to friends .,what is about a teacher who has been in the classroom for 50 years . Batidam himself is corrupt and thief.",1230894132333367299,2020-02-21 16:36:44+00:00,1.0,0.0,public servant acquire expensive vehicles john dramani mahama ghana properties sharing friends teacher classroom years batidam corrupt thief,0.47333333333333333,0.243,0.617,0.5888888888888889
"The National Youth Organizer of the ruling New Patriotic Party (NPP), Henry Nana Boakye, aka Nana B, has called on former President John Dramani Mahama to apologize for making what he called ‘irresponsible’ comments over the… https://pemsantv.com/nana-b-chides-mahama/",1230883532488265730,2020-02-21 15:54:37+00:00,0.0,0.0,national youth organizer ruling new patriotic party npp henry nana boakye aka nana b called former president john dramani mahama apologize making called comments URL,0.0,0.21918181818181817,0.849,0.22727272727272727
"His Excellency John Dramani Mahama, former President of the Republic of ... https://youtu.be/vg9No6lkUcU via @YouTube",1230863117862817793,2020-02-21 14:33:30+00:00,0.0,0.0,excellency john dramani mahama former president republic URL via USER_MENTION,0.0,0.28,0.72,0.0
JOHN DRAMANI MAHAMA’s CV ON CORRUPTION — ABRONYE DC http://breakingnewsgh.com/john-dramani-mahamas-cv-on-corruption-abronye-dc/,1230846116054405121,2020-02-21 13:25:56+00:00,0.0,0.0,john dramani cv corruption abronye dc URL,0.0,0.0,1.0,0.0
