tweets,id,date,likes,retweets,clean_tweet,sentiment_negative,sentiment_positive,sentiment_neutral,subjectivity"It is not, because it us John Dramani Mahama""s legacy most of our media houses are corrupt....",1219410838756429825,2020-01-21 00:06:14+00:00,1.0,0.0,us john dramani legacy media houses corrupt,0.5,0.0,1.0,1.0
John Dramani Mahama + Julius Debrah (Perfect Match) Not William Addo Danquah Akufo Addo + Goodnight! ,1219370919635845122,2020-01-20 21:27:36+00:00,0.0,0.0,john dramani mahama julius debrah perfect match william addo danquah akufo addo goodnight,0.0,1.236,0.764,1.0
"The flagbearer of the National Democratic Congress (NDC), John Dramani Mahama, says as part of fighting corruption, his second coming will see the abolishing of the entitlement system for political officeholders. ",1219233797574733824,2020-01-20 12:22:44+00:00,1.0,0.0,flagbearer national democratic congress ndc john dramani mahama says part fighting corruption second coming see abolishing entitlement system political officeholders,0.116,0.0,0.884,0.05
But who advised John Dramani Mahama that there's anything like Automatic promotion in GES?,1219225386439061504,2020-01-20 11:49:18+00:00,0.0,0.0,advised john dramani mahama theres anything like automatic promotion ges,0.0,0.217,0.783,0.0
"#SayNoToNewRegister #StopJeanMensahNow RT CheEsquire: To help process staple farm produce by our farmers, John Dramani Mahama will establish Staple Crop Processing Zones. ",1219174605765648384,2020-01-20 08:27:31+00:00,1.0,0.0,saynotonewregister stopjeanmensahnow cheesquire help process staple farm produce farmers john dramani mahama establish staple crop processing zones,0.0,0.144,0.856,0.0
We will not allow John Dramani Mahama name to appear on 2020 presidential ballot for stealing state resources . ALL PARTIES PREPARE FOR SUPREME COURT RULING . STEALING STATE PROPERTY IS NOT DIFFERENT FROM STREET ROBBERY,1219013261049372672,2020-01-19 21:46:24+00:00,0.0,0.0,allow john dramani mahama name appear presidential ballot stealing state resources parties prepare supreme court ruling stealing state property different street robbery,0.227,0.252,0.521,0.6
Happy birthday to you @JohnDramaniMahama's close friend. May you continue to age with grace..,1218947589531455488,2020-01-19 17:25:26+00:00,0.0,0.0,happy birthday USER_MENTION close friend may continue age grace,0.0,1.4180000000000001,0.382,1.0
Ghana DOES NOT need a new voters register. Ghana simply needs a new President in the person of John Dramani Mahama.,1218885790954115073,2020-01-19 13:19:53+00:00,21.0,4.0,ghana need new voters register ghana simply needs new president person john dramani mahama,0.0,0.0909090909090909,1.0,0.42207792207792205
"The automatic promotion of teachers in the country will be brought back should the National Democratic Congress (NDC) win the 2020 elections, its flagbearer, John Dramani Mahama has promised. ",1218830667838083072,2020-01-19 09:40:50+00:00,1.0,0.0,automatic promotion teachers country brought back national democratic congress ndc win elections flagbearer john dramani mahama promised,0.0,0.696,0.704,0.2
"Flagbearer of the National Democratic Congress, NDC, John Dramani Mahama says his second coming will see robust policies that will fix Ghana’s economy and educational system. ",1218829941325942784,2020-01-19 09:37:57+00:00,2.0,0.0,flagbearer national democratic congress ndc john dramani mahama says second coming see robust policies fix economy educational system,0.0,0.249,0.876,0.125
"Ahead of the 2020 general elections, the flagbearer of the opposition National Democratic Congress (NDC), John Dramani Mahama, says the NDC is prepared to run an issue-based campaign. ",1218827750087315457,2020-01-19 09:29:15+00:00,1.0,0.0,ahead general elections flagbearer opposition national democratic congress ndc john dramani mahama says ndc prepared run issuebased campaign,0.0,0.15100000000000002,0.899,0.5
niiafoteyquaye: #SayNoToNewRegister #StopJeanMensahNow One more legacy of John Dramani Mahama. ,1218810190314733568,2020-01-19 08:19:28+00:00,0.0,0.0,niiafoteyquaye saynotonewregister stopjeanmensahnow one legacy john dramani mahama,0.0,0.0,1.0,0.0
#SayNoToNewRegister #StopJeanMensahNow One more legacy of John Dramani Mahama. http://www.myjoyonline.com/news/2020/january-10th/somanya-campus-of-uesd-complete-pioneers-to-commence-school-2020-academic-year.php,1218807873272197120,2020-01-19 08:10:16+00:00,0.0,0.0,saynotonewregister stopjeanmensahnow one legacy john dramani mahama URL,0.0,0.0,1.0,0.0
"Enemies are not God. All I want to say is,evil thinkers shld depart from their evil ways because John Dramani Mahama is winning this election by the power of God. What is written is written! Vote John Dramani Mahama for better Ghana.....",1218765560592457728,2020-01-19 05:22:07+00:00,5.0,1.0,enemies god want say thinkers shld depart evil ways john dramani mahama winning election power god written written vote john dramani mahama better ghana,0.209,0.324,0.467,0.75
ELECTION 2020: NDC launches E-payment platform to raise funds for party -John Dramani Mahama #Electionheadquarters #JoyNews #Fundraising #NDC – at Joy 99.7 FM,1218507372462780416,2020-01-18 12:16:11+00:00,71.0,7.0,election ndc launches epayment platform raise funds party john dramani mahama electionheadquarters joynews fundraising ndc joy fm,0.0,1.102,0.698,0.2
H.E. John Dramani Mahama from January 2021 shall undertake the following interventions in the Education sector: 1. Abolish Double Track. Question: What is he going to do to double track teachers? 2.... https://www.facebook.com/100011163450837/posts/1010109576037815/,1218464480054607872,2020-01-18 09:25:44+00:00,0.0,0.0,h.e john dramani mahama january shall undertake following interventions education sector abolish double track question going double track teachers URL,0.0,0.0,1.0,0.03333333333333333
"#StopJeanMensahNow RT Joy997FM: The Ministry of Aviation, Railways, and Transport will be remerged into one Ministry. - John Dramani Mahama #ElectionHeadquarters",1218443740811010050,2020-01-18 08:03:20+00:00,3.0,0.0,stopjeanmensahnow joy997fm ministry aviation railways transport remerged one ministry john dramani mahama electionheadquarters,0.0,0.0,1.0,0.0
"#StopJeanMensahNow RT CheEsquire: To help process staple farm produce by our farmers, John Dramani Mahama will establish Staple Crop Processing Zones. ",1218443524762472449,2020-01-18 08:02:28+00:00,1.0,0.0,stopjeanmensahnow cheesquire help process staple farm produce farmers john dramani mahama establish staple crop processing zones,0.0,0.153,0.847,0.0
"WHAT YOU MISSED: We will abolish the Double Track - Leader and Flagbearer of the NDC, John Dramani Mahama ",1218439562139181057,2020-01-18 07:46:43+00:00,0.0,0.0,missed abolish double track leader flagbearer ndc john dramani mahama,0.196,0.0,0.804,0.0
Akufo-Addo Has Not Appointed John Dramani Mahama to Anything in His Government ,1218352463495028736,2020-01-18 02:00:37+00:00,1.0,0.0,akufoaddo appointed john dramani mahama anything government,0.0,0.0,1.0,0.0
NPP-Deputy-Communications-Director-Mame-Yaa-Aboagye-has-called-former-President-John-Dramani-Mahama-a-ldquohypocriterdquo https://is.gd/p4j5aa,1218310552612564993,2020-01-17 23:14:05+00:00,0.0,0.0,nppdeputycommunicationsdirectormameyaaaboagyehascalledformerpresidentjohndramanimahamaaldquohypocriterdquo URL,0.0,0.0,1.0,0.0
"It's no use,following me(flagbearer)around. Go to your branches, support them morally and materially.-John Dramani Mahama ",1218282891911757825,2020-01-17 21:24:10+00:00,0.0,0.0,go branches support morally materially.john dramani mahama,0.0,0.31,0.69,0.25
“I’m ready to rescue this country from a friends and family government “ - John Dramani Mahama,1218278223022157824,2020-01-17 21:05:37+00:00,1.0,0.0,ready rescue country friends family government john dramani mahama,0.0,0.7969999999999999,0.403,0.5
"The flagbearer of the opposition National Democratic Congress (NDC), John Dramani Mahama, says the NDC is prepared to run an... https://is.gd/3nOurD",1218273312008097792,2020-01-17 20:46:06+00:00,0.0,0.0,flagbearer opposition national democratic congress ndc john dramani mahama says ndc prepared run URL,0.0,0.128,0.872,0.0
"The flagbearer of the opposition National Democratic Congress (NDC), John Dramani Mahama, says as part of fighting corruption, his... https://is.gd/YuzfOU",1218271046966497281,2020-01-17 20:37:06+00:00,0.0,0.0,flagbearer opposition national democratic congress ndc john dramani mahama says part fighting corruption URL,0.161,0.0,0.839,0.0
WELCOME BACK TO THE JUBILEE HOUSE HE. JOHN DRAMANI MAHAMA @JDMahama,1218242614819987456,2020-01-17 18:44:07+00:00,2.0,1.0,welcome back jubilee house john dramani mahama USER_MENTION,0.0,0.7,0.7,0.45
"To help process staple farm produce by our farmers, John Dramani Mahama will establish Staple Crop Processing Zones. ",1218220984966242305,2020-01-17 17:18:10+00:00,25.0,8.0,help process staple farm produce farmers john dramani mahama establish staple crop processing zones,0.0,0.172,0.828,0.0
Was it not John Dramani Mahama who promised to build 10 Teacher Training Colleges in each of the previous ten regions of Ghana? Well he says he’s going to build 6 universities in each of the 6 new regions in four. ,1218217207873916928,2020-01-17 17:03:10+00:00,10.0,2.0,john dramani mahama promised build teacher training colleges previous ten regions ghana well says going build universities new regions four,0.010101010101010102,0.204,0.796,0.20707070707070707
WHAT YOU MISSED: Arrival of Former President John Dramani Mahama at the fundraising Launch. ,1218196881139994626,2020-01-17 15:42:24+00:00,4.0,0.0,missed arrival former president john dramani mahama fundraising launch,0.216,0.0,0.784,0.0
I’ll reintroduce automatic promotion of teachers if re-elected in 2020– Mr. John Dramani Mahama. Do you think this is a good reason to re-elect Mr. Mr. John Dramani Mahama? #2020ghanaelection @JDMahama #ghanavotes,1218190026032459777,2020-01-17 15:15:09+00:00,0.0,0.0,reintroduce automatic promotion teachers reelected mr john dramani mahama think good reason reelect mr mr john dramani mahama USER_MENTION ghanavotes,0.0,0.832,0.868,0.6000000000000001
I Am Very Ready To Work With Ghanaians Now – John Dramani Mahama https://ghtrendinglinks.com/i-am-very-ready-to-work-with-ghanaians-now-john-dramani-mahama/,1218174570131337221,2020-01-17 14:13:44+00:00,3.0,1.0,ready work ghanaians john dramani mahama URL,0.0,0.494,0.706,0.5
H.E. John Dramani Mahama from January 2021 shall undertake the following interventions in the Education sector: 1. Abolishment of Double Track. 2. Free Technical and Vocational education. 3. Scraping of... https://www.facebook.com/1192964573/posts/10219079657681009/,1218161621698273280,2020-01-17 13:22:17+00:00,5.0,3.0,h.e john dramani mahama january shall undertake following interventions education sector abolishment double track free technical vocational education scraping URL,0.0,0.288,0.852,0.27999999999999997
John Dramani Mahama seeks his own interests not of the country. His motives are those of a wrecker. Give him not the chance again. The tried and tested Akufo Addo can do more! #4MORE4NANA @Generals_Creed,1218151284500463616,2020-01-17 12:41:13+00:00,3.0,0.0,john dramani mahama seeks interests country motives wrecker give chance tried tested akufo addo USER_MENTION,0.0,0.235,0.765,0.0
John Dramani Mahama seeks his own interests not of the country. His motives are those of a wrecker. Give him not the chance again. The tried and tested Nana Addo can do more! #4MORE4NANA,1218141259145142272,2020-01-17 12:01:22+00:00,2.0,1.0,john dramani mahama seeks interests country motives wrecker give chance tried tested nana addo,0.0,0.25,0.75,0.0
"The flagbearer of the National Democratic Congress (NDC), John Dramani Mahama, says as part of fighting corruption, his second coming... ",1218135894927921153,2020-01-17 11:40:03+00:00,0.0,0.0,flagbearer national democratic congress ndc john dramani mahama says part fighting corruption second coming,0.161,0.0,0.839,0.0
"Flagbearer of the National Democratic Congress (NDC), John Dramani Mahama is hoping to use robust policies to revamp technical education... ",1218134636825468929,2020-01-17 11:35:03+00:00,1.0,0.0,flagbearer national democratic congress ndc john dramani mahama hoping use robust policies revamp technical education,0.0,0.286,0.714,0.1
"Flag bearer of the National Democratic Congress, John Dramani Mahama, has said his return to power will see massive transformation in... ",1218133633464094721,2020-01-17 11:31:04+00:00,0.0,0.0,flag bearer national democratic congress john dramani mahama said return power see massive transformation,0.0,0.0,1.0,1.0
"""Ghanaians look forward to the NDC stepping up to the plate and rescuing power from this government"" - John Dramani Mahama https://www.soireenews.com/ghanaians-look-forward-to-the-ndc-stepping-up-to-the-plate-and-rescuing-power-from-this-government-john-dramani-mahama",1218130234215751681,2020-01-17 11:17:34+00:00,0.0,0.0,ghanaians look forward ndc stepping plate rescuing power government john dramani mahama URL,0.0,0.0,1.0,0.0
Was it not John Dramani Mahama who promised to build 10 Teacher Training Colleges in each of the previous ten regions of Ghana? Well he says he’s going to build 6 universities in each of the 6 new regions in four... https://www.facebook.com/671469652/posts/10158258244749653/,1218118938552258560,2020-01-17 10:32:41+00:00,9.0,1.0,john dramani mahama promised build teacher training colleges previous ten regions ghana well says going build universities new regions four URL,0.010101010101010102,0.195,0.805,0.20707070707070707
Hey guys I need some answers has John Dramani Mahama come out with any policy on how to achieve rescue mission?,1218116781287575552,2020-01-17 10:24:06+00:00,11.0,4.0,hey guys need answers john dramani mahama come policy achieve rescue mission,0.0,0.231,0.769,0.0
"John Dramani Mahama will cut down the number of Akufo-Addo’s 124 ministers by 40. Ministers take home an average of Gh¢ 590,000/pa in salaries, allowances and other entitlements. Reducing the numbers by 40 will save the tax payer Gh¢ 23.6M in a year and Gh¢ 1.13BILLION in 4years! ",1218110540029009920,2020-01-17 09:59:18+00:00,177.0,61.0,john dramani mahama cut number ministers ministers take home average salaries allowances entitlements reducing numbers save tax payer year,0.243,0.199,0.708,0.39999999999999997
"Ⓐⓦⓐⓚⓔ ⒼⒽ Ⓨⓞⓤⓣⓗ : “One of the immediate measures we will take is to put an immediate and permanent end to the purchase of duty post vehicles by political appointees…Government vehicles will remain government vehicles,” - John Dramani Mahama...",1218093476941791232,2020-01-17 08:51:30+00:00,0.0,0.0,immediate measures take put immediate permanent end purchase duty post vehicles political vehicles remain government john dramani mahama,0.0,0.0,1.0,0.1
niiafoteyquaye: #StopJeanMensahNow John Dramani Mahama will Establish One Public University with Campuses in each of the six newly created regions with emphasis on Technical Education and Engineering. #RescueMission2020,1218085373546508288,2020-01-17 08:19:18+00:00,0.0,0.0,niiafoteyquaye stopjeanmensahnow john dramani mahama establish one public university campuses six newly created regions emphasis technical education engineering rescuemission2020,0.0,0.14545454545454545,0.9,0.20707070707070707
"Hey Ghana, John Dramani Mahama says vote for him, this time no state vehicle will be stolen and distribute to friends .",1218083407672041472,2020-01-17 08:11:29+00:00,0.0,0.0,hey ghana john dramani mahama says vote time state vehicle stolen distribute friends,0.185,0.179,0.636,0.0
#StopJeanMensahNow John Dramani Mahama will Establish One Public University with Campuses in each of the six newly created regions with emphasis on Technical Education and Engineering. #RescueMission2020,1218081093007659008,2020-01-17 08:02:18+00:00,11.0,3.0,stopjeanmensahnow john dramani mahama establish one public university campuses six newly created regions emphasis technical education engineering rescuemission2020,0.0,0.15045454545454545,0.895,0.20707070707070707
"My candid advice to you Mr. John Dramani Mahama, relax. Politics is not your calling. You are a great speaker so take time to invest in that",1218079241042112513,2020-01-17 07:54:56+00:00,0.0,0.0,candid advice mr john dramani mahama relax politics calling great speaker take time invest,0.0,1.068,0.632,0.775
"Former president of the Republic of Ghana, John Dramani Mahama is resorting to various convincing promises to win the votes of Ghanaians in the December 7 general elections after losing to Nana Addo Dankwa Akuffo Addo in the 2016 elections. ",1218077918754168833,2020-01-17 07:49:41+00:00,4.0,0.0,former president republic ghana john dramani mahama resorting various convincing promises win votes ghanaians december general elections losing nana addo dankwa akuffo addo elections,0.082,0.5569999999999999,0.631,0.48
John Dramani Mahama is just a lifelong politician using typical talking points to scam voters. #83kom,1218076594947969024,2020-01-17 07:44:25+00:00,3.0,0.0,john dramani mahama lifelong politician using typical talking points scam voters,0.4033333333333333,0.0,0.73,0.55
@JDMahama Hi good morning his Exellency (John Dramani Mahama) please I visited your office at America Embassy about two months ago to meet you and i was asked to submit a letter to book appointment before seeing you.,1218074511674945536,2020-01-17 07:36:08+00:00,0.0,0.0,USER_MENTION hi good morning exellency john dramani mahama please visited office america embassy two months ago meet asked submit letter book appointment seeing,0.0,0.8979999999999999,0.802,0.6000000000000001
@henrydeey and Ex-President John Dramani Mahama ,1218052054586929153,2020-01-17 06:06:54+00:00,1.0,0.0,USER_MENTION expresident john dramani mahama,0.0,0.0,1.0,0.0
NDC will bring back automatic promotion for teachers – John Dramani Mahama. Read more here. https://coverghana.com/ndc-will-bring-back-automatic-promotion-for-teachers-john-dramani-mahama/,1217965596513574914,2020-01-17 00:23:21+00:00,1.0,0.0,ndc bring back automatic promotion teachers john dramani mahama read URL,0.0,0.0,1.0,0.0
"Curious why Nana Addo is desperately using his electoral stooges to bury the current biometric voters register that got him elected President of Ghana in 2016?? In fact, he got 1,000,000 votes more than then incumbent President John Dramani Mahama. Check the figures...",1217926558041673744,2020-01-16 21:48:14+00:00,1.0,0.0,curious nana addo desperately using electoral stooges bury current biometric voters register got elected president ghana fact got votes incumbent president john dramani mahama check figures,0.3233333333333333,0.08,0.83,0.7999999999999999
John Dramani Mahama will Establish One Public University with Campuses in each of the six newly created regions with emphasis on Technical Education and Engineering. #RescueMission2020,1217921956101677056,2020-01-16 21:29:56+00:00,85.0,20.0,john dramani mahama establish one public university campuses six newly created regions emphasis technical education engineering rescuemission2020,0.0,0.15645454545454546,0.889,0.20707070707070707
"So, nurses would not be the beneficiaries of a second coming of John Dramani Mahama right? ",1217889053347061760,2020-01-16 19:19:12+00:00,1.0,0.0,nurses would beneficiaries second coming john dramani mahama right,0.0,0.40185714285714286,0.741,0.26785714285714285
H.E. John Dramani Mahama from January 2021 shall undertake the following interventions in the Education sector: 1. Abolishment of Double Track. 2. Free Technical and Vocational education. 3. Scraping of... https://www.facebook.com/100001126301207/posts/2622098651170986/,1217860760598130690,2020-01-16 17:26:46+00:00,4.0,2.0,h.e john dramani mahama january shall undertake following interventions education sector abolishment double track free technical vocational education scraping URL,0.0,0.288,0.852,0.27999999999999997
The Next John Dramani Mahama @JDMahama government will abolish the Double Track System,1217844008061493251,2020-01-16 16:20:12+00:00,2.0,1.0,next john dramani mahama USER_MENTION government abolish double track system,0.0,0.0,1.0,0.0
"#So, what prevented former president of Ghana ;JDM from paying teachers higher when he had all n absolute power? #SalaryHigh of 20% to teachers if NDC win power,according to the manifesto of John Dramani Mahama. #Power is sweet,so listen to workers than to lose n comeback,JDM.",1217836085646184454,2020-01-16 15:48:43+00:00,0.0,0.0,prevented former president ghana jdm paying teachers higher n absolute power salaryhigh teachers ndc win manifesto john dramani mahama power listen workers lose n,0.094,0.48350000000000004,0.734,0.44999999999999996
#Fact The opposition NDC @OfficialNDCGh and Former President John Dramani Mahama @JDMahama is a government and President in waiting come 7 December 2020.#Rescuemission #SayNoToNewRegister,1217833610402766848,2020-01-16 15:38:53+00:00,2.0,2.0,fact opposition ndc USER_MENTION former president john dramani mahama USER_MENTION government president waiting come december rescuemission saynotonewregister,0.0,0.0,1.0,0.0
"The Ministry of Aviation, Railways and Transport will be remerge into one Ministry - John Dramani Mahama #AdomNews #ElectionHeadquarters",1217819361458692098,2020-01-16 14:42:16+00:00,8.0,4.0,ministry aviation railways transport remerge one ministry john dramani mahama adomnews electionheadquarters,0.0,0.0,1.0,0.0
"The Ministry of Aviation, Railways, and Transport will be remerged into one Ministry. - John Dramani Mahama Me: The salaries, bonuses and allowances of the other 4 ministers can even create over 300 jobs in the ministry . Visionary JM 2020 ALL FOR JM.",1217818119437266944,2020-01-16 14:37:20+00:00,14.0,3.0,ministry aviation railways transport remerged one ministry john dramani mahama salaries bonuses allowances ministers even create jobs ministry visionary jm jm,0.0,0.336,0.664,0.0
"VIDEO -The Ministry of Aviation, Railways and Transport will be remerge into one Ministry - John Dramani Mahama #ElectionHeadquarters #JoyNews #Fundraising #NDC",1217809453866721282,2020-01-16 14:02:54+00:00,26.0,4.0,video ministry aviation railways transport remerge one ministry john dramani mahama electionheadquarters joynews fundraising ndc,0.0,0.0,1.0,0.0
"The Ministry of Aviation, Railways, and Transport will be remerged into one Ministry. - John Dramani Mahama #ElectionHeadquarters",1217808547293036547,2020-01-16 13:59:18+00:00,68.0,7.0,ministry aviation railways transport remerged one ministry john dramani mahama electionheadquarters,0.0,0.0,1.0,0.0
Arrival of Former President John Dramani Mahama at the Launch of fundraising platforms #AdomNews,1217804415819710469,2020-01-16 13:42:53+00:00,1.0,0.0,arrival former president john dramani mahama launch fundraising platforms adomnews,0.0,0.0,1.0,0.0
“The Next NDC Regime come 2021 will make Technical & Vocational Education Free”... ~H.E John Dramani Mahama Me: when next #4More4Nana,1217803216471150592,2020-01-16 13:38:07+00:00,1.0,0.0,next ndc regime come make technical vocational education john dramani mahama next,0.0,0.075,1.0,0.125
VIDEO - Arrival of Former President John Dramani Mahama at the NDC Launch #ElectionHeadquarters #JoyNews #Fundraising #NDC,1217800973562929153,2020-01-16 13:29:12+00:00,39.0,6.0,video arrival former president john dramani mahama ndc launch electionheadquarters joynews fundraising ndc,0.0,0.0,1.0,0.0
Educational reforms and investments are a cardinal point of the next John Dramani Mahama administration. #RescueMission2020#Hope,1217799469758140416,2020-01-16 13:23:13+00:00,75.0,6.0,educational reforms investments cardinal point next john dramani mahama administration,0.0,0.125,1.0,0.125
Teachers clearly would be one of the biggest beneficiaries of a second coming of John Dramani Mahama. #RescueMission2020,1217798750741110785,2020-01-16 13:20:22+00:00,147.0,16.0,teachers clearly would one biggest beneficiaries second coming john dramani mahama rescuemission2020,0.0,0.40499999999999997,0.645,0.19166666666666665
"The Member of Parliament (MP) for Assin Central, Kennedy Agyapong, has revealed that former Director of the Danquah institute Gabby Asare Ochere-Darko declined an invitation to circulate naked pictures of former President John Dramani Mahama by #allghana https://ghanatoday.net/2020/01/16/gabby-declined-blackmailers-bid-to-release-mahamas-nude-pictures-kennedy-agyapong-claims/",1217760802956087296,2020-01-16 10:49:34+00:00,0.0,0.0,member parliament mp assin central kennedy agyapong revealed former director danquah institute gabby asare ocheredarko declined invitation circulate naked pictures former president john dramani mahama allghana URL,0.0,0.0,1.0,0.1625
"#SayNoToNewRegister #StopJeanMensahNow Even President “Do Nothing”, Nana Addo Dankwa Akufo-Addo [NAkufoAddo] believes he has developed Ghana within his three years in office. I can confidently therefore conclude that John Dramani Mahama [JDMahama] made Ghana HEAVEN",1217727552749477889,2020-01-16 08:37:27+00:00,0.0,0.0,saynotonewregister stopjeanmensahnow even president nana addo dankwa akufoaddo believes developed ghana within three years office confidently therefore conclude john dramani mahama made ghana heaven,0.0,0.525,0.775,0.5666666666666667
