tweets,id,date,likes,retweets,clean_tweet,sentiment_negative,sentiment_positive,sentiment_neutral,subjectivity"""I gave GhC50m to six (6) Ghanaian pharmaceutical companies, I didn't go round erecting billboards calling them 1D1F"" John Dramani Mahama [@JDMahama] #JohnMahamaLIVE",1209237680443330560,2019-12-23 22:21:44+00:00,14.0,3.0,gave ghc50m six ghanaian pharmaceutical companies didnt go round erecting billboards calling john dramani mahama johnmahamalive,0.2,0.0,1.0,0.4
"""I gave GhC50m to six (6) Ghanaian pharmaceutical companies, I didn't go round erecting billboards calling them 1D1F"" John Dramani Mahama [@JDMahama]. @etsedafeamekpor @shiracflanxy @deskyei @NAkufoAddo @Citi973 @BigDaddyCee7 @tabi_henry @JOYNEWSONTV @RescueMission16",1209233716012371969,2019-12-23 22:05:59+00:00,26.0,8.0,gave ghc50m six ghanaian pharmaceutical companies didnt go round erecting billboards calling john dramani mahama USER_MENTION USER_MENTION USER_MENTION USER_MENTION USER_MENTION USER_MENTION USER_MENTION USER_MENTION USER_MENTION,0.2,0.0,1.0,0.4
"Why is the government allowing John Dramani Mahama to create confusion in the country . We have only one president at a time, who has the power to address the nation . Mahama has no right to address the public. He has the right to hold press conference but not address the nation.",1209233596315308032,2019-12-23 22:05:30+00:00,0.0,0.0,government allowing john dramani mahama create confusion country one president time power address nation mahama right address public right hold press conference address nation,0.084,0.2704761904761905,0.837,0.37936507936507935
I completely agree with you #John Dramani Mahama https://twitter.com/JOYNEWSONTV/status/1209225994713944066,1209226518444101633,2019-12-23 21:37:22+00:00,1.0,0.0,completely agree john dramani mahama URL,0.0,0.45799999999999996,0.642,0.4
“You can’t ask Ghanaians to tighten their belts whilst you live large with rented private jets and spend GhC70m on foreign travels with GhC2m on refreshments alone” ~ John Dramani Mahama ,1209221207557574658,2019-12-23 21:16:16+00:00,30.0,6.0,ask ghanaians tighten belts whilst live large rented private jets spend ghc70m foreign travels ghc2m refreshments john dramani mahama,0.0,0.056412337662337664,1.0,0.35714285714285715
John Dramani Mahama [@JDMahama],1209218398351187968,2019-12-23 21:05:07+00:00,2.0,0.0,john dramani mahama,0.0,0.0,1.0,0.0
"Upon listening to H.E JOHN DRAMANI MAHAMA. I have fully come to a decisive conclusion that ""I am not wasting my vote on any other person, my vote is for The NDC"" @OfficialNDCGh @JDMahama @johndumelo1",1209217397250498562,2019-12-23 21:01:08+00:00,0.0,0.0,upon listening h.e john dramani mahama fully come decisive conclusion wasting vote person vote ndc USER_MENTION USER_MENTION USER_MENTION,0.129,0.104,0.766,0.0
"niiafoteyquaye: ""I gave GhC50m to six (6) Ghanaian pharmaceutical companies, I didn't go round erecting billboards calling them 1D1F"" John Dramani Mahama [@JDMahama]",1209214957755289603,2019-12-23 20:51:26+00:00,0.0,0.0,niiafoteyquaye gave ghc50m six ghanaian pharmaceutical companies didnt go round erecting billboards calling john dramani mahama,0.2,0.0,1.0,0.4
niiafoteyquaye: “I will cancel the teacher licensure exams. I will improve the final exams our teachers take and also the improve quality of teaching as well as learning at Colleges of Education” ~ John Dramani Mahama [@JDMahama],1209214956098461698,2019-12-23 20:51:26+00:00,1.0,0.0,niiafoteyquaye cancel teacher licensure exams improve final exams teachers take also improve quality teaching well learning colleges john dramani mahama,0.077,0.305,0.618,1.0
John Dramani Mahama says he will cancel Nabco. Citizens beware of the second coming of the Incompetent one,1209214528237572096,2019-12-23 20:49:44+00:00,8.0,1.0,john dramani mahama says cancel nabco citizens beware second coming incompetent one,0.513,0.0,0.662,0.18333333333333335
"'I will make technical and vocational education free at all levels'........ His Excellency John Dramani Mahama. Me: this is what I have been always advocating for, Thank u Mr. President. ",1209214509249966080,2019-12-23 20:49:39+00:00,0.0,0.0,make technical vocational education free levels excellency john dramani mahama always advocating thank u mr president,0.0,0.6503333333333333,0.583,0.43333333333333335
President Akuffo Addo Described The Affirmative Action Bill As Controversial. But John Dramani Mahama Sees It As Vital Tool For Women Empowerment. Ghanaian Women Should Decide Who To Support Now. #AffimativeAction #GenderEquality,1209212429802057730,2019-12-23 20:41:24+00:00,0.0,0.0,president akuffo addo described affirmative action bill controversial john dramani mahama sees vital tool women empowerment ghanaian women decide support affimativeaction genderequality,0.07,0.5285,0.739,0.5875
"“I will reduce the size of Ministers, the size of Ministries and the expenditure that Ghanaians spend on the office of the President. Those are the immediate things that I will do.” John Dramani Mahama [@JDMahama]",1209211203064647682,2019-12-23 20:36:31+00:00,1.0,0.0,reduce size ministers size ministries expenditure ghanaians spend office president immediate things john dramani mahama,0.0,0.0,1.0,0.0
"""I gave GhC50m to six (6) Ghanaian pharmaceutical companies, I didn't go round erecting billboards calling them 1D1F"" John Dramani Mahama #JohnMahamaLIVE",1209210815271854080,2019-12-23 20:34:59+00:00,1.0,0.0,gave ghc50m six ghanaian pharmaceutical companies didnt go round erecting billboards calling john dramani mahama johnmahamalive,0.2,0.0,1.0,0.4
"Common sense approach to job creation in the health sector; add more facilities, that’s the only place nurses and other health workers work, you don’t keep them closed and lie you’re employing more ~John Dramani Mahama [@JDMahama]",1209208908004417542,2019-12-23 20:27:24+00:00,5.0,1.0,common sense approach job creation health sector add facilities place nurses health workers work keep closed lie employing dramani mahama,0.2,0.1,0.9,0.3
“I will abolish the 50% Communication Service Tax (CST) also known as talk time task” ~ John Dramani Mahama [@JDMahama],1209208619713138690,2019-12-23 20:26:15+00:00,0.0,0.0,abolish communication service tax cst also known talk time john dramani mahama,0.0,0.0,1.0,0.0
“You can’t ask Ghanaians to tighten their belts whilst you live large with rented private jets and spend GhC70m on foreign travels with GhC2m on refreshments alone” ~ John Dramani Mahama [@JDMahama],1209208615145541632,2019-12-23 20:26:14+00:00,4.0,0.0,ask ghanaians tighten belts whilst live large rented private jets spend ghc70m foreign travels ghc2m refreshments john dramani mahama,0.0,0.056412337662337664,1.0,0.35714285714285715
"The struggle to have a say on his delivery , John Dramani Mahama you be Guy #StillStopJeanMensah",1209206246412365827,2019-12-23 20:16:49+00:00,0.0,0.0,struggle say delivery john dramani mahama guy stillstopjeanmensah,0.247,0.0,0.753,0.0
"Today, my question was the first to catch the eye of His Excellency John Dramani Mahama. Unfortunately, the later part of it was what came into the video as a result of the suspected internet sabotage. We don’t... https://www.facebook.com/100000914735148/posts/3513966778643779/",1209203965210120199,2019-12-23 20:07:45+00:00,1.0,0.0,today question first catch eye excellency john dramani mahama unfortunately later part came video result suspected internet sabotage URL,0.294,0.259,0.573,0.16666666666666666
"""I gave GhC50m to six (6) Ghanaian pharmaceutical companies, I didn't go round erecting billboards calling them 1D1F"" _John Dramani Mahama",1209201982558343170,2019-12-23 19:59:53+00:00,10.0,0.0,gave ghc50m six ghanaian pharmaceutical companies didnt go round erecting billboards calling dramani mahama,0.2,0.0,1.0,0.4
"""I gave GhC50m to six (6) Ghanaian pharmaceutical companies, I didn't go round erecting billboards calling them 1D1F"" John Dramani Mahama [@JDMahama]",1209201861816926208,2019-12-23 19:59:24+00:00,4.0,3.0,gave ghc50m six ghanaian pharmaceutical companies didnt go round erecting billboards calling john dramani mahama,0.2,0.0,1.0,0.4
“I will cancel the teacher licensure exams. I will improve the final exams our teachers take and also the improve quality of teaching as well as learning at Colleges of Education” ~ John Dramani Mahama [@JDMahama],1209201628731125762,2019-12-23 19:58:28+00:00,5.0,2.0,cancel teacher licensure exams improve final exams teachers take also improve quality teaching well learning colleges john dramani mahama,0.08,0.317,0.602,1.0
“You can’t ask Ghanaians to tighten their belts whilst you live large with rented private jets and spend GhC70m on foreign travels with GhC2m on refreshments alone” ~ John Dramani Mahama [@JDMahama],1209201172369858560,2019-12-23 19:56:40+00:00,25.0,6.0,ask ghanaians tighten belts whilst live large rented private jets spend ghc70m foreign travels ghc2m refreshments john dramani mahama,0.0,0.056412337662337664,1.0,0.35714285714285715
"“I will reduce the size of Ministers, the size of Ministries and the expenditure that Ghanaians spend on the office of the President. Those are the immediate things that I will do.” John Dramani Mahama [@JDMahama]",1209200593887215616,2019-12-23 19:54:22+00:00,14.0,5.0,reduce size ministers size ministries expenditure ghanaians spend office president immediate things john dramani mahama,0.0,0.0,1.0,0.0
“I will abolish the 50% Communication Service Tax (CST) also known as talk time tax” ~ John Dramani Mahama #JohnMahamaLive,1209200499951407105,2019-12-23 19:53:59+00:00,1.0,0.0,abolish communication service tax cst also known talk time john dramani mahama johnmahamalive,0.0,0.0,1.0,0.0
Man like John Dramani Mahama. ,1209200402035617792,2019-12-23 19:53:36+00:00,0.0,0.0,man like john dramani mahama,0.0,0.385,0.615,0.0
“I will abolish the 50% Communication Service Tax (CST) also known as talk time task” ~ John Dramani Mahama [@JDMahama],1209197570133823489,2019-12-23 19:42:21+00:00,24.0,6.0,abolish communication service tax cst also known talk time john dramani mahama,0.0,0.0,1.0,0.0
"""I gave GhC50m to six (6) Ghanaian pharmaceutical companies, I didn't go round erecting billboards calling them 1D1F"" John Dramani Mahama [@JDMahama]",1209195794257121280,2019-12-23 19:35:17+00:00,11.0,1.0,gave ghc50m six ghanaian pharmaceutical companies didnt go round erecting billboards calling john dramani mahama,0.2,0.0,1.0,0.4
Hahahahaaaaa ahh ahh anokwa So someone asked Mr. John Dramani Mahama what he will do to reduce fuel prices and his answer was that “I will appoint one Managing Director for BOST and TOR” Me: The alternative is empty #Presisoo,1209195423489052674,2019-12-23 19:33:49+00:00,8.0,1.0,hahahahaa ahh ahh anokwa someone asked mr john dramani mahama reduce fuel prices answer appoint one managing director bost alternative empty presisoo,0.179,0.0,0.921,0.5
H. E. John Dramani Mahama! ,1209191882053566466,2019-12-23 19:19:45+00:00,0.0,0.0,h e john dramani mahama,0.0,0.0,1.0,0.0
“I will cancel the teacher licensure exams. I will improve the final exams our teachers take and also the improve quality of teaching as well as learning at Colleges of Education” ~ John Dramani Mahama [@JDMahama],1209191170817056768,2019-12-23 19:16:55+00:00,20.0,4.0,cancel teacher licensure exams improve final exams teachers take also improve quality teaching well learning colleges john dramani mahama,0.08,0.317,0.602,1.0
John Dramani Mahama and I are friends again. It was an error/ technical glitch. We are cool.,1209190565750947840,2019-12-23 19:14:31+00:00,0.0,0.0,john dramani mahama friends technical glitch cool,0.0,0.694,0.481,0.375
"The flag bearer of the National Democratic Congress (NDC), Mr John Dramani Mahama, has denied speculations that he is set to announce... https://is.gd/ZbhKRP",1209187936320667648,2019-12-23 19:04:04+00:00,0.0,0.0,flag bearer national democratic congress ndc mr john dramani mahama denied speculations set announce URL,0.172,0.0,0.828,0.0
All the collapsed Indegenous banks will be restored when I am elected the President. Scam alert John Dramani Mahama,1209180150241333248,2019-12-23 18:33:07+00:00,0.0,0.0,collapsed indegenous banks restored elected president scam alert john dramani mahama,0.333,0.264,0.402,0.0
I will make Technical and Vocational Education free. ~John Dramani Mahama. Me: ,1209178111461543936,2019-12-23 18:25:01+00:00,0.0,0.0,make technical vocational education free dramani mahama,0.0,0.5883333333333333,0.645,0.43333333333333335
"Eii God!! John Dramani Mahama you are a PRESIDENT wati... he knows what to do, he knows how to rule!! How did we even choose NANA SLEEPING BEAUTY mpo????? Asem oo",1209174493777842176,2019-12-23 18:10:39+00:00,0.0,0.0,eii god john dramani mahama president wati knows knows rule even choose nana sleeping beauty mpo asem oo,0.0,0.269,0.731,0.0
Join President John Dramani Mahama [@JDMahama] NOW...,1209161424922169344,2019-12-23 17:18:43+00:00,2.0,1.0,join president john dramani mahama,0.0,0.355,0.645,0.0
 Life is ironic. The page managers of John Dramani Mahama had blocked me. Me oh! What I do? ,1209160023739379712,2019-12-23 17:13:09+00:00,0.0,0.0,life ironic page managers john dramani mahama blocked oh,0.34,0.2,0.66,0.9
"""I'll abolish the 50% increase on CST!""—John Dramani Mahama",1209159767177990150,2019-12-23 17:12:08+00:00,0.0,0.0,ill abolish increase dramani mahama,0.846,0.284,0.37,1.0
John Dramani Mahama Live in 8 minutes ,1209155165439299584,2019-12-23 16:53:51+00:00,0.0,0.0,john dramani mahama live minutes,0.0,0.13636363636363635,1.0,0.5
John Dramani Mahama is live again today! The Xmas just got better! #JohnMahamaLIVE,1209142768783822848,2019-12-23 16:04:35+00:00,1.0,1.0,john dramani mahama live today xmas got better johnmahamalive,0.0,0.5841818181818181,0.734,0.5
I AM RAP NATION || Your Web MIC.: Former Ghanaian President John Dramani Mahama will... https://iamrapnation.blogspot.com/2019/12/former-ghanaian-president-john-dramani.html?spref=tw cc:@JDMahama,1209142299965480961,2019-12-23 16:02:43+00:00,0.0,0.0,rap nation web mic former ghanaian president john dramani mahama URL,0.0,0.0,1.0,0.0
The most visionary leader of the 4th republic is John Dramani Mahama #JohnMahamaLive,1209135339161489408,2019-12-23 15:35:04+00:00,1.0,0.0,visionary leader republic john dramani mahama johnmahamalive,0.0,0.362,0.638,0.0
Former President John Dramani Mahama will this evening nominate Prof. Jane Naana Opoku Agyemang as his running mate for election 2020 .,1209094534338101248,2019-12-23 12:52:55+00:00,13.0,2.0,former president john dramani mahama evening nominate prof jane naana opoku agyemang running mate election,0.0,0.0,1.0,0.0
"#4MoreToStealMore #Fact AFRICA (Ghana inclusive) no longer needs POLITICIANS but instead, LEADERS who are GENERATIONAL THINKERS like John Dramani Mahama [JDMahama]. He is not your ordinary POLITICIAN, he is a VISIONARY LEADER",1209030021345693696,2019-12-23 08:36:34+00:00,5.0,3.0,fact africa ghana inclusive longer needs politicians instead leaders generational thinkers like john dramani mahama ordinary politician visionary leader,0.25,0.258,0.742,0.5
"#4MoreToStealMore #Fact It is obvious the name John Dramani Mahama [JDMahama] continues to choke, haunt and torment the president and his NPP. Nana Addo is just a TOTAL FAILURE",1209030020116729858,2019-12-23 08:36:34+00:00,0.0,0.0,fact obvious name john dramani mahama continues choke haunt torment president npp nana addo total failure,0.5355555555555556,0.0,0.57,0.5166666666666667
"According to his memoirs, the former president of Ghana, John Dramani Mahama, felt a kinship with Jackson because of their similar backgrounds:",1208895901101633536,2019-12-22 23:43:37+00:00,0.0,0.0,according memoirs former president ghana john dramani mahama felt kinship jackson similar backgrounds,0.0,0.0,1.0,0.2
JOHN DRAMANI MAHAMA #JohnMahamaLive #JohnMahamaLive #JohnMahamaLive,1208827144601821187,2019-12-22 19:10:24+00:00,2.0,0.0,john dramani mahama johnmahamalive johnmahamalive johnmahamalive,0.0,0.0,1.0,0.0
President Nana Addo Dankwa Akufo-Addo has belittled the chances of his archrival John Dramani Mahama as the country goes to the polls in... https://is.gd/Oi1epx,1208814982592221186,2019-12-22 18:22:05+00:00,0.0,0.0,president nana addo dankwa akufoaddo belittled chances archrival john dramani mahama country goes polls URL,0.169,0.101,0.73,0.0
The President is clueless. It is shameful to see him disgrace himself like that. He continually says he has not seen the infrastructure the NDC built under John Dramani Mahama. That smacks of dishonesty or complete... https://www.facebook.com/1020164865/posts/10218921837529844/,1208814485433126915,2019-12-22 18:20:06+00:00,50.0,9.0,president clueless shameful see disgrace like continually says seen infrastructure ndc built john dramani mahama smacks dishonesty complete URL,0.337,0.195,0.568,0.4
"#Fact AFRICA (Ghana inclusive) no longer needs POLITICIANS but instead, LEADERS who are GENERATIONAL THINKERS like John Dramani Mahama [@JDMahama]. He is not your ordinary POLITICIAN, he is a VISIONARY LEADER #RescueMission #NoToNewRegister @tabi_henry @Joy997FM",1208783396790505473,2019-12-22 16:16:34+00:00,11.0,3.0,fact africa ghana inclusive longer needs politicians instead leaders generational thinkers like john dramani mahama ordinary politician visionary leader rescuemission notonewregister USER_MENTION USER_MENTION,0.25,0.219,0.781,0.5
"#Fact AFRICA (Ghana inclusive) no longer needs POLITICIANS but instead, LEADERS who are GENERATIONAL THINKERS like John Dramani Mahama [@JDMahama]. He is not your ordinary POLITICIAN, he is a VISIONARY LEADER #RescueMission #GO4JM2020",1208782675542233089,2019-12-22 16:13:42+00:00,6.0,2.0,fact africa ghana inclusive longer needs politicians instead leaders generational thinkers like john dramani mahama ordinary politician visionary leader rescuemission go4jm2020,0.25,0.237,0.763,0.5
"#Fact AFRICA (Ghana inclusive) no longer needs POLITICIANS but instead, LEADERS who are GENERATIONAL THINKERS like John Dramani Mahama [@JDMahama]. He is not your ordinary POLITICIAN, he is a VISIONARY LEADER",1208772690032701440,2019-12-22 15:34:01+00:00,23.0,3.0,fact africa ghana inclusive longer needs politicians instead leaders generational thinkers like john dramani mahama ordinary politician visionary leader,0.25,0.258,0.742,0.5
"#Fact It is obvious the name John Dramani Mahama [@JDMahama] continues to choke, haunt and torment the President @NAkufoAddo and his NPP. Nana Addo is just a TOTAL FAILURE @Joy997FM @JOYNEWSONTV",1208768677174300674,2019-12-22 15:18:05+00:00,0.0,0.0,fact obvious name john dramani mahama continues choke haunt torment president USER_MENTION npp nana addo total failure USER_MENTION USER_MENTION,0.4855555555555556,0.0,0.62,0.5166666666666667
"#Fact It is obvious the name John Dramani Mahama [@JDMahama] continues to choke, haunt and torment Pres @NAkufoAddo and his @NPP_GH. Nana Addo is just a TOTAL FAILURE",1208768078470889472,2019-12-22 15:15:42+00:00,13.0,1.0,fact obvious name john dramani mahama continues choke haunt torment pres USER_MENTION USER_MENTION nana addo total failure,0.5175555555555555,0.0,0.588,0.5166666666666667
"#Fact It is obvious the name John Dramani Mahama [@JDMahama] continues to choke, haunt and torment the president and his NPP. Nana Addo is just a TOTAL FAILURE",1208762523777933312,2019-12-22 14:53:38+00:00,7.0,1.0,fact obvious name john dramani mahama continues choke haunt torment president npp nana addo total failure,0.5355555555555556,0.0,0.57,0.5166666666666667
*One More Year for Prez @NAkufoAddo to Exit Power and His Excellency John Dramani Mahama @JDMahama and @OfficialNDCGh to Assume office as our next President and Government of the republic of Ghana* @awalmohammeddu1 @Joy997FM @GHOneTV @AgboDyer @CheEsquire @JohnTerryTresh @bb_sems,1208736058264948736,2019-12-22 13:08:28+00:00,13.0,4.0,year prez USER_MENTION exit power excellency john dramani mahama USER_MENTION USER_MENTION assume office next president government republic USER_MENTION USER_MENTION USER_MENTION USER_MENTION USER_MENTION USER_MENTION USER_MENTION,0.0,0.132,0.868,0.0
#Fact John Dramani Mahama [@JDMahama] and NDC government machinery spent GH¢1.5 billion in its entire 4 year term in office. Nana Addo Dankwa Akufo-Addo [@NAkufoAddo] and the NPP in opposition screamed and... https://www.facebook.com/100008145644871/posts/2600170313597798/,1208700278968586240,2019-12-22 10:46:17+00:00,11.0,2.0,fact john dramani mahama ndc government machinery spent billion entire year term office nana addo dankwa akufoaddo npp opposition screamed URL,0.153,0.0,0.897,0.3625
John Dramani Mahama writes I participated in the colourful durbar held in Dormaa to celebrate the 20th anniversary of the enstoolment of Osagyefo Oseadeeyo Agyemang Badu II as Dormaahene on Saturday. We have... https://www.facebook.com/100001126301207/posts/2568714903176028/,1208691784886431745,2019-12-22 10:12:32+00:00,0.0,0.0,john dramani mahama writes participated colourful durbar held dormaa celebrate anniversary enstoolment osagyefo oseadeeyo agyemang badu ii dormaahene saturday URL,0.0,0.163,0.837,0.0
His excellency John dramani mahama good morning sir please help me to buy mahama camboo for me I am an orphan and a sick person to I can't do any hard work please help me I am chatting you from Upper West region Bamahu,1208688520103124992,2019-12-22 09:59:34+00:00,0.0,0.0,excellency john dramani mahama good morning sir please help buy mahama camboo orphan sick person cant hard work please help chatting upper west region bamahu,0.21648809523809526,0.409,0.451,0.49970238095238095
Today the whole Government will meet to discuss one person John Dramani Mahama ,1208634280563359744,2019-12-22 06:24:02+00:00,0.0,0.0,today whole government meet discuss one person john dramani mahama,0.0,0.2,1.0,0.4
"This song is for my incoming mp and president, John Dramani Mahama and Mohammed Adamu Ramadan. You victory is on its way to meet you. ",1208626465664897024,2019-12-22 05:52:59+00:00,0.0,0.0,song incoming mp president john dramani mahama mohammed adamu ramadan victory way meet,0.0,0.0,1.0,0.0
"What Ever the NPP Government will do, John Dramani Mahama will still Win 2020 Elections",1208440757461409792,2019-12-21 17:35:02+00:00,9.0,1.0,ever npp government john dramani mahama still win elections,0.0,1.122,0.678,0.4
Akuffo Addo government has failed to unearth the millions of dollars stolen by John Dramani Mahama and his government.,1208379750093393920,2019-12-21 13:32:37+00:00,0.0,0.0,akuffo addo government failed unearth millions dollars stolen john dramani mahama government,0.894,0.0,0.606,0.3
"Ghanaians, John Dramani Mahama is destroying our democracy with moneycracy . Reliable sources indicates that he is paying a lot of people to create bad impression about the current government and very bad.",1208376645842804738,2019-12-21 13:20:17+00:00,0.0,0.0,ghanaians john dramani mahama destroying democracy moneycracy reliable sources indicates paying lot people create bad impression current government bad,0.7709999999999999,0.14,0.49,0.43333333333333335
#Fact When then President John Dramani Mahama [@JDMahama] chided the NPP’s running mate Dr. Mahamudu Bawumia [@MBawumia] that he couldn’t criticize the former because he the latter had not been president... https://www.facebook.com/100008145644871/posts/2598656167082546/,1208158436371947522,2019-12-20 22:53:12+00:00,10.0,2.0,fact president john dramani mahama chided running mate dr mahamudu bawumia criticize former latter president URL,0.148,0.0,0.852,0.0
Manasseh Azure Likens John Dramani Mahama &amp; Prez Akufo Addo To Wife Beaters In Latest Article https://nsempafie.com/manasseh-azure-likens-john-dramani-mahama-prez-akufo-addo-to-wife-beaters-in-latest-article/,1208066030754521088,2019-12-20 16:46:01+00:00,0.0,0.0,manasseh azure likens john dramani mahama prez akufo addo wife beaters latest article URL,0.0,0.5,1.0,0.9
"“In fact, if the only alternative to John Dramani Mahama in the 2016 election was a sheep, I would have voted for that sheep.” ~ Manasseh Azure Awuni Sheep paaa",1208064725579423744,2019-12-20 16:40:49+00:00,0.0,0.0,fact alternative john dramani mahama election sheep would voted manasseh azure awuni sheep paa,0.0,0.0,1.0,0.0
"The Leader & Flagbearer of the National Democratic Congress, H. E. John Dramani Mahama, met with the leadership of the Trade Union Congress of Ghana on Wednesday to address some national issues. ",1208053170682912775,2019-12-20 15:54:55+00:00,6.0,0.0,leader flagbearer national democratic congress h e john dramani mahama met leadership trade union congress ghana wednesday address national issues,0.0,0.0,1.0,0.0
"This festive season, I am going to be very generous and share loads of presents to all my close friends, particularly John Dramani Mahama. I will give him a nicely wrapped campaign message as a special Xmas present. So you see, Mahama can't excape from my extreme munificence.",1208030776752820225,2019-12-20 14:25:55+00:00,6.0,0.0,festive season going generous share loads presents close friends particularly john dramani mahama give nicely wrapped campaign message special xmas present see mahama cant excape extreme munificence,0.0,0.6497619047619048,0.55,0.5809523809523809
"“In fact, if the only alternative to John Dramani Mahama in the 2016 election was a sheep, I would have voted for that sheep.” ~ Manasseh Azure Awuni Me: No comment .",1208019516707549187,2019-12-20 13:41:11+00:00,8.0,3.0,fact alternative john dramani mahama election sheep would voted manasseh azure awuni comment,0.0,0.0,1.0,0.0
